,Unnamed: 0,Topic,Joke
4974,4974,['ATM' 'Twitter'],"How come I need a complex, indecipherable password to get on Twitter but only a 4-digit number to remove all my money from an ATM?"
4975,4975,['appendectomy' 'doctors' 'hysterectomy' 'nurse' 'tonsillectomy'],"Did you hear about the nurse who swallowed razor blade? She gave herself a tonsillectomy, an appendectomy, a hysterectomy, and circumcised three of the doctors on her shift."
4987,4987,['NASCAR' 'Nascar'],Nascar Rain I think if NASCAR would quit being sponsored by the movie Noah we wouldn't have so much rain on race day :)
4988,4988,['autocorrect function' 'wife'],How do I disable the autocorrect function on my wife?
4991,4991,['Jesus' 'Thanksgiving' 'drinking'],"My uncle used to ruin every Thanksgiving with his drinking problem, but now he found Jesus and ruins it with that."
4996,4996,['Dalai Lama' 'kebab shop'],"What did the Dalai Lama say to the guy in the kebab shop? ""Make me one with everything."""
5003,5003,['Abola chicken noodle soup' 'Ebola patients'],What do Ebola patients eat? Abola chicken noodle soup!
5007,5007,['math teacher' 'wife'],What do my wife and my math teacher have in common? They both love to create problems that I am apparently supposed to solve.
5008,5008,['Benefits' 'fire hydrant factory' 'parking'],"I used to work at a fire hydrant factory. Benefits were good, but the parking was terrible."
5010,5010,['renewable energy' 'wind turbines'],Two wind turbines are having a paddle 1: What's your thoughts on renewable energy? 2: I'm a big fan.
5013,5013,['binman job' 'interview'],"In my interview for the binman job, I asked if you needed any special training... The interviewer said ""nah you just sort of pick it up as you go along""."
5018,5018,['Porsche' 'porcupine'],What's the difference between a Porsche and a porcupine? The pricks are on the outside of a porcupine.
5025,5025,['dyslexic whorehouse' 'furniture store'],Oriental Rugs and Tubs... could be a furniture store or a dyslexic whorehouse.
5031,5031,['Pixar movies' 'Ratatouille' 'Toy Story'],"Rick Astley: Do you have any Pixar movies I can borrow? Me: You can have Cars, Toy Story & Ratatouille, but I'm never gonna give you UP."
5033,5033,['bears' 'wolves' 'woodland creatures'],"Love will tear us apart. Also, bears, wolves and some other woodland creatures."
5034,5034,['Mexico' 'olympic games'],Why does Mexico rarely wins medals at the olympic games? All the ones who can run/swim/jump already made it to America.
5038,5038,['amoeboo' 'protozoa'],What kind of protozoa likes  Halloween? An amoeboo!
5051,5051,['construction worker' 'drill bits' 'toolbox'],"A construction worker asked me to make a joke about the contents of his toolbox. Unfortunately, I don't have any drill bits."
5054,5054,['Sean Connery' 'US Open'],What time does Sean Connery get to the US Open? Ten-ish
5056,5056,['ap' 'deaf people'],Is onamonapia.... umderstood by deaf people?
5057,5057,['Money Saving Tips' 'travelmediacafe'],10 Money Saving Tips (Joke) http://travelmediacafe.com/2014/11/18/10-money-saving-tips/
5062,5062,['Danke memes' 'internet'],What do Germans look at on the internet? Danke memes
5065,5065,['Boobbook' 'Facebook'],It's called Facebook not Boobbook. So next time try to get your face in the picture too? K thanks.
5072,5072,['Aaron' 'NFC Championship game' 'Packers' 'Seahawks'],Why did the Seahawks win the 2015 NFC Championship game against the Packers? Because even Aaron Rodgers is a 12!
5073,5073,"['Global prosthetics distribution' 'artificial limb salesman'
 'international arms dealer']",Her: What do you do? Me: Global prosthetics distribution. Her: You're an artificial limb salesman? Me: I prefer international arms dealer'.
5075,5075,['Easter Bungee' 'egg laden rabbit'],Did you hear about the egg laden rabbit who jumps off bridges? He's the Easter Bungee!
5078,5078,['Alan Rickman' 'David Bowie'],"Knock, knock. Who's there? Alan Rickman and David Bowie. Alan Rickman and David Bowie who? Alan Rickman and David Bowie have both died recently."
5079,5079,['Disney World' 'plutocracy'],What kind of government does Disney World have? A plutocracy
5091,5091,['Canadians' 'swimming pool'],"How do you get 50 Canadians out of a swimming pool? ""Please get out of the swimming pool."""
5092,5092,['infomercial' 'shipping'],Me: This infomercial is so stupid. *10 mins later* Me: So all I have to pay on the 2nd one is the shipping and handling?
5095,5095,['Detroit Lions' 'zookeepers'],The Detroit Lions have been given guns to subvert increasing violence in the area... ...local zookeepers fear the worst.
5097,5097,['indoor shedding' 'life coach'],"I just vacuumed my dog to cut down on indoor shedding, if you're looking for a life coach or whatever."
5098,5098,['carpets' 'home invasion'],I'm sorry I committed a home invasion but somebody had to do something about those carpets.
5102,5102,['Paralympics' 'abortion jokes' 'dead baby jokes'],"Most Offensive Jokes You've Ever Heard Dark/black humor, abortion jokes, dead baby jokes, show me your worst reddit. I'll start. What's better than winning gold in the Paralympics? - Walking"
5106,5106,['Bethesda Softworks' 'Fallout 4'],Bethesda Softworks announce that Fallout 4 will be postponed until April 2016 Don't worry you are on the jokes section
5108,5108,['Child cust' 'divorce'],What's the most trifling thing about divorce when you have kids? Child custardy
5114,5114,['cell' 'prison inmate'],How do you call a prison inmate? With a cell phone.
5116,5116,['Macarena' 'salad fork'],"*Throws up some gang signs* *stabs self in eye with salad fork* Hubs: Next time you do the Macarena, put your fork down."
5122,5122,['BMW' 'porcupine'],What's the difference between a BMW and a porcupine? The porcupine has pricks on the outside.
5126,5126,['Paul Walker' 'xbox'],I added Paul Walker on xbox the other day... Too bad he spends all his time on the dashboard. *Courtesy of my cousin*
5129,5129,['Paul walker' 'steering wheel' 'windscreen'],"Did you know Paul walker was on the radio when he died? He was also on the dashboard, the windscreen and the steering wheel."
5131,5131,['Accidental exercise' 'ISIS'],Got all the way to the car and realized I left my keys back at the office The two things I hate most in life: 1. ISIS and 2. Accidental exercise
5136,5136,['Aldous Huxley' 'Weed strin humor' 'dispensary'],Weed strin humor At the dispensary there is a strain called Aldous Huxley. If you smoke it with your wife she becomes sterile. #LegalWeedJokes
5137,5137,['pea soup' 'roast beef'],"What's the difference between roast beef and pea soup? You can roast beef, but you can't pee soup."
5142,5142,['Americans' 'League of Legends'],Why are Americans so bad at League of Legends? because they can't protect their towers
5144,5144,['police car' 'porcupine'],"What's the difference between a porcupine and a police car? In a police car, the pricks are on the inside."
5151,5151,['poker games' 'vampire'],A vampire stopped coming to my nightly poker games. All I said was that he made too many mistakes...
5152,5152,['History' 'Lazy Susan'],"History has forgotten the name of the man that invented the ""Lazy Susan"", but it conveniently still remembers the name of his ex-wife."
5158,5158,['awards luncheon thing' 'pajama jeans'],"my wife wouldn't let me wear my pajama jeans to her awards luncheon thing because you can ""see my balls through them"" smh"
5163,5163,['business plans' 'nuns'],"If a bunch of nuns wanted to help small business, they could create their own small business writing business plans... And call it 'Nun of Your Business'"
5167,5167,['dyslexic moment' 'hemogoblin' 'vampire'],"What do you get when you cross a ghoul and a vampire? A hemogoblin. I came up with this during lecture after a dyslexic moment, thought someone may like it."
5179,5179,['genetics' 'upbringing'],"Personality is 40% genetics, 40% upbringing, and 20% the last movie you watched."
5183,5183,['3rd grade homework' 'calculator'],"""You have to be pretty bad at math to use a calculator to check 3rd grade homework."" -My smartass kid to me just now."
5184,5184,['Agnes' 'Santa Fe' 'Topeka'],Knock Knock Who's there ! Agnes ! Agnes who ? Agnes & Topeka & the Santa Fe !
5185,5185,['dyslexia' 'insomnia'],What does it mean to be an Agnostic with insomnia and dyslexia? You stay up all night wondering if there is a dog.
5188,5188,['netflix' 'psych'],Hear about psych on netflix? Thats messed up
5189,5189,['color' 'twerkquoise'],What's miley cyrus's favourite color? twerkquoise
5194,5194,['Central Europe' 'Chess tournament' 'Czech mate'],I recently became friends with someone from Central Europe We met at a Chess tournament and I've never once beaten him in a game. He's my Czech mate
5198,5198,['BMW' 'porcupine'],What's the difference between a porcupine and a BMW? Porcupines have pricks on the OUTSIDE.
5200,5200,['Personal psychic' 'pension scheme' 'wealthy client'],"Wanted: Personal psychic for wealthy client. Salary: $10,000 per week plus bonuses. Free accommodation. 10 weeks paid leave per year. Company car. Generous pension scheme. You know where to apply."
5234,5234,['politics' 'priest' 'rabbi'],"A priest, a rabbi, and a scientist walk into a bar... and have a wonderful conversation about politics."
5235,5235,['Alvin' 'chipmunks'],It's awful that those other chipmunks force Alvin to wear an A on his sweater just because he's an adulterer.
5237,5237,['dining room' 'patio' 'room'],"Wife: honey I want you to whisper dirty things in my ear! Husband: kitchen, living room, dining room, patio..."
5243,5243,['Michael Jackson' 'Neil Armstrong' 'moon'],"What's the difference between Michael Jackson and Neil Armstrong? Neil Armstrong was the first man on the moon, and Michael Jackson rapes kids and gets away with it."
5247,5247,['Beethoven' 'piano'],It's pretty impressive that Beethoven could play the piano considering he was a St. Bernard.
5254,5254,['ice cream' 'semi truck'],Why did Sally drop her ice cream? Because a semi truck hit her.
5260,5260,['Texas sheriff' 'suicide'],"What did the Texas sheriff say about the black guy who was shot 15 times? ""Worse case of suicide I ever saw."""
5263,5263,['beer' 'women'],I like my women like I like my beer Stout and bitter
5264,5264,['Pokemaster' 'Tupperware containers' 'confused squirrels'],"Yeah, I'm basically a Pokemaster. *waves vaguely at shelves of confused squirrels in partially sealed Tupperware containers*"
5265,5265,['Riposte' 'comeback'],What's the number one comeback on r/Jokes? Riposte.
5267,5267,['breast implants' 'crusty bus station'],"What's the difference between a dirty parking lot and a crab with breast implants? Ones a crusty bus station, and the other is a busty crustacean."
5270,5270,['pedophiles' 'wedding rings'],Where do pedophiles get the wedding rings? They go to Jared.
5274,5274,['black market' 'underground slave trade'],What do you call the underground slave trade? The black market.
5275,5275,['dyslexic' 'toga party'],I realized I was dyslexic when I went to a toga party dressed as a goat.
5283,5283,['Finnish line' 'Norwegian line' 'Sweden'],Every year there is a race from one side of Sweden to the other... They start at the Norwegian line and end up at the Finnish line.
5284,5284,['epileptic boyfriend' 'strobe light'],I bought my epileptic boyfriend a strobe light for his birthday. He's gonna have a fit when he sees it.
5285,5285,['Mortal Kombat' 'relationship advice'],"Pretty sure the ""FINISH HIM"" guy from Mortal Kombat is giving relationship advice to every girl I date."
5294,5294,['April Fools Day' 'fire cracker'],On April Fools Day a mother put a fire cracker  under the pancakes. She blew her stack.
5298,5298,['Jewish women' 'Jews' 'circumcised'],Why do Jews get circumcised? Because Jewish women won't touch anything that's not at least 10% off.
5300,5300,['BBQ joint' 'hot waiter'],'I like the smell of your meat' may not have been the best greeting to the hot waiter at the BBQ joint I picked for lunch.
5305,5305,['KGB' 'intellectuals'],"Q. ""Why do the KGB operate in groups of three?"" A. ""One can read, one can write and one to keep an eye on the two intellectuals."""
5312,5312,['mentally disabled girl' 'virginity'],I lost my virginity to a mentally disabled girl last night I wanted my first time to be special.
5315,5315,['Chicken Tarka Masala' 'Chicken Tikka'],"I've just enjoyed a meal of Chicken Tarka Masala... It's like Chicken Tikka, only otter."
5319,5319,['caravans' 'underwear' 'women'],What does caravans and women underwear have in common? Both are in the way if you are in a hurry
5326,5326,['Klondike Bar' 'palindrome'],I wouldn't create a palindrome for a Klondike Bar. But I'd... Murder for a jar of red rum.
5328,5328,['codeine' 'pain killers'],Why is it so hard for programmers to get a prescription for pain killers? They have a history with codeine.
5329,5329,['kids' 'penis' 'women'],"Life is like a penis... Life is like a penis, simple, chilled and free. It's women who make it hard... And kids who make it harder."
5336,5336,['Bible' 'cookies'],"[doorbell] ""Hi, do you have time to discuss the Bible?"" ""You have cookies?"" ""No, sir I-"" ""Come back when you have cookies."" *closes door*"
5337,5337,['Bank Teller' 'bank teller'],"Me: *slides note to bank teller* Bank Teller: So....you're not robbing us, you just want to take a selfie with ""mad cash"" on your face?"
5351,5351,['anchors' 'banjos' 'fishermen'],Q: Why do so many fishermen own banjos? A: They make great anchors!
5358,5358,"[""Trader Joe's"" 'Whole Foods']",Choosing between Trader Joe's and Whole Foods is white people's real Twilight.
5368,5368,['kleptomaniacs' 'puns'],It's hard to explain puns to kleptomaniacs. Because they always take things literally.
5372,5372,['Jason Bourne' 'Starbucks'],I'm the Jason Bourne of avoiding people I know at Starbucks.
5376,5376,['cantaloupe' 'melons'],What do Romeo and Juliet have in common with melons? They both cantaloupe.
5377,5377,['Excel' 'Excel ENT' 'record label'],If Excel had a record label.... It would be Excel ENT. I'll see myself out.
5383,5383,['Gay Parenting' 'wife'],"I Wasn't Too Keen On The Idea Of Gay Parenting Until I met my wife, who was raised by two dads. That's when I came to my senses and realized.. NO MOTHER-IN-LAW!"
5387,5387,['Easter eggs' 'blonde chicks'],Why do only 20 percent of blonde chicks lay Easter eggs? The rest are hunting peckers.
5391,5391,['Angels' 'women'],What do you call a woman in heaven? An Angel A crowd of women in heaven? - A host of Angels And all women in heaven? - PEACE ON EARTH!
5395,5395,['Halloween' 'burgers'],Why aren't burgers the least bit scared of Halloween? They're used to people 'goblin' them!
5397,5397,['Single Asian ladies' 'antivirus check'],Ever since I got my antivirus check done on my computer. Single Asian ladies don't wanna do it with me anymore.
5399,5399,['Viagra' 'old men'],Why do old men take Viagra? It stops them from rolling out of bed.
5404,5404,['delivery guy' 'utensils'],just ordered so much food the delivery guy gave me four sets of utensils but it's okay I still love myself
5405,5405,['domestic violence' 'multiple personalities' 'narcissist'],Why did the narcissist with multiple personalities and a propensity for domestic violence only have one black eye? Because she didn't need to re-beat himself.
5413,5413,['pet projects' 'taxidermist'],Why couldn't the taxidermist finish anything he started? Because he kept getting side tracked by pet projects
5414,5414,['aardvarks' 'ants' 'uncles'],How do ants hide from aardvarks? They disguise themselves as uncles!
5417,5417,['empire' 'grand heresy' 'ostrich'],An ostrich commits grand heresy against the empire. He is promptly ostrichized. No? ok.
5419,5419,['Oinkment' 'pig'],What does a pig put on his cut? Oinkment
5421,5421,['lightning' 'women'],They say men are 3 times as likely to be struck by lightning than women Because lighting is 1/3 as likely to strike in the kitchen
5435,5435,['BMW commercials' 'Facebook' 'c'],I didn't post that copyright notice thing on my Facebook and I've already seen SIX of MY photos of me with my casseroles in BMW commercials
5442,5442,['Guac Guac' 'Mexican duck'],What does a Mexican duck say? Guac Guac
5447,5447,['drum' 'sheep' 'snake'],"What does a sheep, a drum, and a snake all say when falling off of a cliff? Baa-Dum-Sss"
5450,5450,['Remorse code' 'telegraph operators'],How do telegraph operators apologize? Remorse code
5455,5455,['AIDS' 'Ebola'],Ebola has been in the US for 1 day and people are already wearing masks. AIDS has been here for 55 years and fools still don't use a condom
5459,5459,['autocorrect' 'lunchtime'],I had a really good joke... but autocorrect ruined the lunchtime
5461,5461,['Patty' 'butcher'],How did the butcher introduce his wife? Meet Patty!
5467,5467,['Romans' 'execution'],"It seems highly unlikely that the Romans would have built a new cross for every execution, which means... Jesus was a repost."
5470,5470,['America' 'American' 'military dictatorship'],Why has there never been a military dictatorship in America? Because they don't have an American embassy over there.
5480,5480,['John' 'President Lincoln' 'kes Booth'],"President Lincoln ""I'm going to miss you, President Lincoln,"" said John Wilkes Booth. Booth lied. He didn't."
5481,5481,['Brussels attack' 'Saudi Arabia TV' 'Saudi TV'],Saudi TV Mistake Saudi Arabia TV reported the Brussels attack 15 minutes earlier than it actually happened. Saudi TV sincerely apologizes for this innocent mistake.
5487,5487,['PMS' 'mad cow disease'],Why do they call it PMS? Because mad cow disease was already taken.
5488,5488,['light bulb' 'pregnant woman'],What's the difference between a pregnant woman and a light bulb? You can always unscrew a light bulb.
5494,5494,['next door neighbour' 'washing line'],My next door neighbour just confronted me about her clothes going missing from the washing line .. I nearly shit her pants
5498,5498,['S congress men' 'U'],Six U.S congress men die and go to heaven.
5506,5506,['Chuck Norris' 'roundhouse kick'],"Chuck Norris can do a roundhouse kick faster than the speed of light. This means that if you turn on a light switch, you will be dead before the lightbulb turns on."
5520,5520,['Amongst Urban Youth' 'Viagra'],Police: Viagra on the Rise as Recreational Drug Amongst Urban Youth The Boys in the Hood are always hard.
5522,5522,['Galactus' 'solar system'],"Galactus is about to eat our solar system when he flips over the label WARNING: CONTAINS MERCURY ""No thanks, I'll eat something else."""
5524,5524,['boogers' 'rice pudding'],What's the difference between boogers and rice pudding? Nobody eats rice pudding.
5530,5530,['American blizzard' 'Canadians'],"84% of Canadians think the preparations for the American blizzard are ""cute"""
5531,5531,['Acne' 'acne' 'priest'],Whats the difference between a priest and acne?? Acne waits until your 12 to come on your face.
5538,5538,['Baja Men' 'DMX' 'Pitbull'],"Rappers are terrible with pets: the Baja Men let their dogs out, DMX never knows where his dogs are at, and Pitbull is awful."
5543,5543,"[""McDonald's"" 'Olympics' 'cancer']",McDonald's being the official restaurant of the Olympics is like smoking being the official medicine of cancer.
5544,5544,['dinosaurs' 'gas prices'],"You know, gas prices really aren't that bad when you consider that you're essentially buying dinosaurs in liquid form."
5557,5557,['Samsung battery' 'headphone jack'],The iPhone doesn't have a headphone jack and the Samsung battery is exploding... It's like the mobile equivalent of our presidential election!
5565,5565,['Two Headed Turtle Kimodo Dragons' 'UFOs'],I've seen: UFOs Ghosts A Two Headed Turtle Kimodo Dragons But nothing is as unbelievable to me as seeing Trump run for president.
5568,5568,['Del Taco' 'SWAT'],"I will die one day at a Del Taco, shot dead by a SWAT team after taking several hostages over what I feel is the meaning of extra cheese."
5570,5570,['Jet fuel' 'steel beams'],"""Pikachu, use astonish!"" *Leans into opponent's ear* ""Jet fuel can't melt steel beams."""
5572,5572,['plaid tie' 'thai restaurant'],What did the businessman wear to the thai restaurant? A plaid tie.
5578,5578,['Hungry Hungry Hippos' 'obese family'],"Every time I see an obese family at a buffet, I throw a sack of marbles onto the table and have a live showing of Hungry Hungry Hippos."
5587,5587,['gas station' 'police officers'],"A bunch of police officers were outside of a gas station today Apparently someone threw a case of beer ontop of his baby. The baby is okay though, it was a light beer"
5608,5608,['French accent' 'French alphabet'],What do you have left after you burn a French alphabet? H Edit: I don't like explaining jokes but since the first guy didn't get I might as well: When pronounced in a French accent it sounds like ash.
5609,5609,['Fresh Tomatoes' 'ketchup bottle' 'kids'],Her: What veggies are the kids having with dinner? Me: (Smacking the bottom of a ketchup bottle) Fresh Tomatoes...
5616,5616,['ATM' 'old lady'],"There was an old lady at a ATM today, she asked me if I could help check her balance. So I pushed her over."
5617,5617,['Concentrated juice' 'hitler'],What kind of juice does hitler drink? Concentrated juice.
5619,5619,['Country Cabin' 'Sears Portrait' 'Toenail Fungal Infection'],Please Choose a Sears Portrait Background: 1. Autumn Leaves 2. Toenail Fungal Infection 3. Country Cabin 4. Alarmed Possum
5620,5620,['indecent exposure' 'photo technician'],"The photo technician got caught masterbating to people's photos They charged him with ""indecent exposure"""
5621,5621,['Barbie doll' 'Grunge Barbie' 'flannel shirt' 'goatee'],There is a new Barbie doll on the market - Grunge Barbie ...with flannel shirt and a goatee
5623,5623,['grandmother' 'horse semen'],"I was going down on my grandmother the other day... When I tasted horse semen, and I thought ""huh, that must be how she died."""
5625,5625,['bartender' 'horse'],"a horse walks into a bar A horse walks into a bar. The bartender says, ""why the long face""? The horse says, ""I have cancer""."
5628,5628,['German kid' 'chocolate'],chocolate just tastes better when you pretend a fat German kid drowned in it
5631,5631,['mexicans' 'quicksand'],What do you call... What do you call four mexicans standing in quicksand? Cuatros Cincos
5633,5633,['Typical' 'neck bard'],"Yeah, I knew Shakespeare in college. Typical neck bard."
5634,5634,['Dos Equis' 'chromosomes'],"I don't always date people with... I don't always date people with chromosomes... But when I do, I prefer Dos Equis."
5637,5637,['millionaire' 'sorceress'],What do you get if you cross a sorceress with a millionaire? A very witch person.
5638,5638,['horror movies' 'serial killer'],Me trying to impress a girl Girl: I'm Into horror movies Me: My dad's a serial killer
5644,5644,['EarPods' 'verbal outbursts'],Wearing 'EarPods' is my favorite way of making the rest of the world believe my verbal outbursts are part of a heated phone conversation.
5653,5653,['Gordon Ramsey' 'risotto'],Every time I cook risotto I feel like Gordon Ramsey is going to walk in and scream at me.
5654,5654,['Family size' 'single person size'],Family size or very determined single person size?
5655,5655,['Chameleon' 'reptile dysfunction'],What do you call a Chameleon that cant change colors? A reptile dysfunction...
5657,5657,['crawl space' 'realtor'],"me as a realtor: This house does include a crawl space. It's probably full of bones already, but you can always add more bones yourself."
5658,5658,['soulmates' 'thermostat setting'],"Chemistry, ok. But soulmates? You'd think if our spirits were perfectly matched, they'd be comfortable at the same thermostat setting."
5662,5662,['Walter White' 'knock knock joke'],Why can't you tell Walter White a knock knock joke? Because he is the one who knocks.
5666,5666,['Grammar' 'Hitler' 'Usain bolt'],Whats the difference between Usain bolt and Hitler? Usain bolt can finish a race. Edit: Grammar
5669,5669,['gay friend' 'sperm bank'],"On his first day, my gay friend lost his job at the sperm bank. He was caught drinking on the job."
5677,5677,['Bill Cosby' 'Ronda Rousey'],How is a Bill Cosby better than Ronda Rousey? He's never met a woman he hasn't knocked out.
5684,5684,['baby' 'trampoline'],What's the difference between a baby and a trampoline? I take my shoes off to jump on a trampoline.
5685,5685,['butcher' 'hotdogs'],What did the butcher say when he handed his customer an empty pack of hotdogs on halloween? Happy halloweenie
5694,5694,['Boko Harambe' 'gorillas' 'terrorist group'],There's a new terrorist group targeting gorillas It's called Boko Harambe
5697,5697,['glasses' 'math'],"I wear glasses during math, Because it improves division."
5699,5699,['aliens' 'ghosts' 'skeletons' 'snakes'],"Keep your friends close, your enemies close, aliens not so close, ghosts close, snakes close, skeletons close, everything just in a big pile"
5718,5718,['Sephora' 'filters'],I spend a lot of money at Sephora for someone who's got access to filters
5721,5721,['parole officer' 'receptionist'],My dad likes to come to my office & tell the receptionist he's my parole officer in case you were wondering how I turned out like this.
5724,5724,['Democratic Party' 'Republican Party' 'donkey' 'elephant' 'pig'],If an elephant is the symbol of the Republican Party and a donkey is the symbol of the Democratic Party what is a pig the symbol of? Any party where there's lots of food.
5726,5726,['6 month check up' 'dental practise'],Check up time. I've just been for my 6 month check up and everything seem to be going well until he slipped his finger in to check my prostate. I will not be using that dental practise again.
5733,5733,['Chris' 'Rihanna'],How can Rihanna tell when Chris Brown's cheating on her? The brand of makeup on his knuckle isn't hers.
5738,5738,['Russian airport' 'Snowden'],Why was Edward stuck at the Russian airport? Because he was Snowden.
