,Unnamed: 0,Topic,Joke
2537,2537,['Father Christmas' 'mountain climbers'],A group of mountain climbers once heard Father Christmas go past. They must have had sharp ears! They were mountain-ears!
2539,2539,['kindle' 'tinder'],i put tinder on my kindle it burst into flames
2543,2543,['Autistic Big Bro' 'public speaker'],"What do you get when you mix a public speaker with someone who had tourettes? A clock! One provides the tic, the other provides the talk Credit to my Autistic Big Bro"
2544,2544,['IBS' 'epileptic oyster' 'prostitute'],"What's the difference between an epileptic oyster and a prostitute with IBS? Well, one you have to shuck between fits..."
2545,2545,['Sixth German Panzer Division' 'Tour de France'],Who won the Tour de France in 1940? the Sixth German Panzer Division
2546,2546,['WiFi' 'wife'],I wish my wife was better in bed. <sighs> <disables autocorrect> I wish my WiFi was better in bed.
2551,2551,['candy brand' 'drummer' 'sheep'],"A drummer trips and falls on a sheep, a candy brand, and then a running faucet *Baa Dum tss*"
2554,2554,['deaf mathematicians' 'sine language'],How do deaf mathematicians communicate? Through sine language.
2556,2556,['America' 'Middle East'],"""You the bomb."" ""No, you the bomb."" In America, a compliment. In the Middle East, an argument."
2557,2557,['license plate' 'sheep farmer'],What does the license plate of the sheep farmer say? Ewe haul.
2558,2558,['Mexican baptism' 'bean dip'],What do you call a Mexican baptism? A bean dip.
2559,2559,['Galaxy Note 7' 'Mass Defect' 'video game'],Have you heard about Samsung's new video game based on the Galaxy Note 7? They're calling it Mass Defect.
2562,2562,['rain stick' 'umbrellas'],Just found out that umbrellas open up. I always wondered why my rain stick never kept me dry. We never stop learning do we.
2569,2569,['department stores' 'girls' 'women'],Gotta love those girls in department stores wearing lab coats--taking time away from their experiments to help women out with their makeup.
2572,2572,['Windows 10' 'Windows OS'],Why is the upcoming Windows OS called Windows 10? Because 7 ate 9...
2574,2574,['Argentina' 'Brazil' 'British Airways' 'England' 'Messi' 'Neymar'],Messi carrying Argentina. Neymar carrying Brazil. British Airways carrying England
2582,2582,"['MLK day' ""Patrick's day""]",What's the difference between MLK day and St Patrick's day? Nobody minds being Irish for one day!!!!
2589,2589,['Christmas' 'Santa Claus'],Kids these days think Christmas is all about getting presents instead of celebrating the birth of Santa Claus.
2593,2593,['Catholic' 'mass' 'protons'],did you know that protons have mass? I didn't even know they were Catholic!
2598,2598,['Canada' 'public protest'],When Canada abolished the penny there was no public protest at all... ...I guess Canada fears change
2605,2605,['Mickey' 'mickey mouse' 'minnie'],"Mickey is getting a divorce ""mickey mouse it says you want to divorce minnie because she was...... extremely silly?"" ""no, i said she was fucking goofy"""
2612,2612,['Alzheimers' 'smoking'],It turns out smoking prevents Alzheimers. You don't live long enough to develop it.
2614,2614,['extrovert' 'introvert'],An introvert looks down at his own shoes. An extrovert looks at other people's shoes.
2615,2615,['camel toe' 'running tights'],"My running tights are giving me a mean camel toe. I'm going to wear my ""Mind the Gap"" t-shirt to the gym"
2617,2617,['Abu Dhabi' 'Dubai' 'Flintstones'],"What is the difference between the people in Dubai &amp; the people in Abu Dhabi? The people in Dubai don't watch The Flintstones, but the people in Abu Dhabi Do!"
2619,2619,['Pulp Fiction' 'orange juice factory'],An orange juice factory decides to host a movie night.. They will be screening Pulp Fiction
2623,2623,['alcohol' 'bread' 'drugs' 'junk food'],"Dear people with resolutions, Please bring all your unwanted.. bread, junk food, soda, drugs, and alcohol to my house. Thanks."
2632,2632,['Ellen' 'Generes' 'Rikki Lake'],Did you hear Ellen DeGeneres drowned? They found her face down in Rikki Lake
2637,2637,['Gump' 'Trump' 'mentally challenged'],"What's similar between Gump and Trump? They are both mentally challenged and ""just felt like runnin'"""
2639,2639,['Africa' 'Superman'],"I'm fed up with all that Superman crap. He saves old women & extinguish fires, but when he flies over Africa, he pretends he doesn't see us?"
2640,2640,['fancy dress shop' 'wizard costume'],I went to the fancy dress shop the other day but they couldn't help me complete my wizard costume You just can't get the staff.
2655,2655,['Ambul' 'Wii U' 'Wii U Wii U'],THE XBOX IS BEING ATTACKED! Here Comes The Ambulance Wii U Wii U Wii U
2657,2657,['spaghetti' 'waitress'],Do not break eye contact with your waitress as you put the spaghetti in your wallet.
2658,2658,['Macbeth' 'baseball' 'witches'],I'd hate to play baseball with the witches from Macbeth Because they think that Fair is Foul and Foul is Fair.
2664,2664,['flat' 'outs' 'pigs'],Why do pigs have flat snouts? From running in to trees.
2670,2670,['Wyoming' 'safe sex'],How do they practice safe sex in Wyoming? They mark the sheep that kick.
2672,2672,['Einstein' 'rappers'],e=mc2 was just Einstein comparing himself to other rappers
2675,2675,['cheerfully obese' 'morbidly obese'],"Maybe being fat isn't bad, it just sounds awful because we say 'morbidly obese'. Let's switch it to 'cheerfully obese' and see what happens."
2683,2683,['female drivers' 'male drivers'],Why do female drivers sit higher up in their seats than male drivers? Because they're sitting on a box.
2685,2685,['divorce' 'tornado'],"Whats the difference between a tornado and a divorce in the south? Nothing, because either way, someone is losing their trailer."
2686,2686,['Buzz Lightyear' 'penis'],I like to nickname my penis Buzz Lightyear Because he likes to travel to the star and beyond
2694,2694,['cattle farmers' 'poker'],"Say friends, why is it tough to play poker with cattle farmers? They're always raising the steaks!"
2700,2700,['flavor' 'pickled venison'],A man starts a line of pickled venison ... ...the most popular flavor so far is dill doe.
2714,2714,['bungie jumper' 'condom'],What does a bungie jumper and a condom wearer have in common? If the rubber snaps they're screwed. &lt;----- this is a classic xD
2731,2731,['Chemistry section' 'firemen'],"[Library] MAN: Do you have books on fire? LIBRARIAN: Yes, in the Chemistry section MAN: Come on boys! *Swarms of firemen enter with hoses*"
2733,2733,['divorciachi' 'mariachi bands'],50% of mariachi bands end in divorciachi.
2734,2734,['air conditioning' 'body dysmorphia' 'gender assumptions'],"When it comes to the topic of body dysmorphia and gender assumptions, i'm not a fan. Infact I identify more closely to an air conditioning unit."
2737,2737,['Titanic' 'mom'],Titanic sank 103 years ago... ...making it the only thing your mom didn't go down on! Hi-YO!
2741,2741,['crocodile' 'priest' 'rabbi'],A rabbi a priest and a crocodile walk into a bar Chuck Norris mother fuckers.....whoooooooooooooo
2743,2743,['ICU ward' 'cannibal'],Did you hear about the cannibal who visited the ICU ward? His doctor told him to eat more vegetables.
2747,2747,['cardboard box' 'homeless lady' 'pickup'],A homeless lady agreed to let me take her home I don't understand why she got pissed when I loaded the cardboard box in my pickup truck.
2748,2748,['business' 'fertilizer industry'],We need to get into the fertilizer industry... I hear business is booming.
2750,2750,['lesbians' 'politician'],What do you get when you combine 99 lesbians and a politician? 100 people that don't do dick
2754,2754,['hippo violation' 'sensitive medical information'],What is it called when sensitive medical information about a very fat patient is disclosed? A hippo violation
2760,2760,['bartender' 'duck'],"So a duck walks into a bar... He waddles over to a seat and settles in. The bartender says ""Hey there, what can I get for you?"" And the duck says ""I... I don't know. I've never made it this far."""
2764,2764,['gastroenterologist' 'motivational speaker'],"""It's not a colonoscopy, it's a colonoscpportunity!"" - gastroenterologist who is also a motivational speaker"
2765,2765,['Jeans' 'diarrhoea' 'hereditary diseases'],Why was diarrhoea classified under hereditary diseases? It runs in the Jeans.
2767,2767,['job interview' 'prom dress'],Shit. Gotta huge job interview tomorrow and I have no clue where I put my prom dress
2771,2771,['clarinet' 'guitar'],What do a guitar and a drum have in common? Neither of them are a clarinet!
2772,2772,['Cars' 'Finding Nemo' 'Pixar collection' 'Rick' 'Toy Story'],"Rick Astley asked to borrow my Pixar collection. I said ""Rick, you can have Toy Story, Cars &amp; Finding Nemo but I'm never gonna give you Up"""
2773,2773,['Jews' 'mobile phones'],What do Jews love most about their mobile phones? They can charge them.
2789,2789,['Home Internet Password' 'orgy'],My Home Internet Password 2kids1dog. Thats an orgy I don't want to be apart of.
2797,2797,['Abu Dhabi' 'Dubai' 'Flintstones'],"Apparently, people in Dubai don't like the Flintstones... ...But people in Abu Dhabi DOOOOOOO!"
2798,2798,['GOATLIKE SPEED' 'REFLEXES' 'shingles'],"I'VE GOT GOATLIKE SPEED & REFLEXES ""Don't you mean catlike-"" BAAAH [Climbs on top of roof and begins eating shingles]"
2826,2826,['Pam cooking spray' 'mosquitoes'],"If you accidentally use Pam cooking spray instead of Off... It still works, because the mosquitoes just slide off your legs."
2843,2843,['English' 'Welsh' 'condoms' 'sheep intestines'],"It is said that the Welsh were the first to use condoms, by making them out of sheep intestines. But the English perfected this technique by removing them from the sheep first."
2846,2846,['Auschwitz' 'Chipotle' 'Jew' 'Mexican' 'Taco night'],Gassy Joke What makes a Mexican gassy? Taco night. What makes a white person gassy? Chipotle. What makes a Jew gassy? Auschwitz
2858,2858,['JEDI' 'LIGHTSABER' 'destructive laser sword'],JEDI WHO INVENTED LIGHTSABER: ok its a destructive laser sword so maybe we shoudnt wear anythig too flowy JEDI IN CHARGE OF COSTUMES: ...OORR
2860,2860,['Bald guys' 'football teams' 'helmet stickers' 'personal achievement'],You know those little helmet stickers some football teams use to reward personal achievement? Bald guys should do that.
2868,2868,['asian parents' 'retarded son'],What did the asian parents call their retarded son? Sum ting wong
2869,2869,['Mexican' 'nigger'],What do you get when you cross a Mexican and a nigger? Someone who is too lazy to steal.
2880,2880,['porn filtering app' 'vanilla porn'],i'm working on a porn filtering app that would show only vanilla porn... but I can't work out the kinks
2882,2882,['Angelina Jolie' 'Brad Pitt'],Brangelina is no more. And it's really sad to see that Brad Pitt is now just 'Br' while Angelina Jolie gets her whole forename back.
2883,2883,['Halloween' 'acoustic guitar'],"This Halloween, make your friends run in terror by walking into their parties as ""guy with acoustic guitar""."
2887,2887,['Lawyers' 'computers' 'lawyers'],"Lawyers and computers have both been proliferating since 1970. Unfortunately, lawyers, unlike computers, have not gotten twice as smart and half as expensive every 18 months."
2890,2890,['redneck divorce' 'tornado'],"What does a tornado and a redneck divorce have in common? In the end, someone is going to lose a trailer."
2891,2891,['Homophones' 'homophobes' 'homophones'],"I like homophobes Homophones, I mean homophones!"
2894,2894,['landline phone' 'youth'],I wish todays youth had to endure the humiliation of having your dad pick up the landline phone and start dialing while you're talking on it
2895,2895,['bartender' 'polar bear'],"So a polar bear walks into a bar... and says, ""I'll have a gin.....and tonic"" The bartender says, ""What's with the big pause?"" And the polar bear says, ""Oh, I've always had them."""
2896,2896,['Aaron Hernandez' 'Edward Snowden'],In the news today What do Aaron Hernandez and Edward Snowden have in common? They're both expatriots (expatriates).
2906,2906,['indecent exposure' 'police officer'],"Steve was walking down the street, when he came across a police officer and was promptly arrested for indecent exposure"
2908,2908,['chameleon' 'reptile dysfunction'],What do you call it when a chameleon won't change colors? A reptile dysfunction
2915,2915,['child abuser' 'facebook pic'],"I'm just saying, a cartoon character facebook pic isnt going to stop a child abuser! If you see one, call the cops, bam, done."
2916,2916,['adrenaline' 'camping'],Why do adrenaline junkies enjoy camping? Because it is in tents
2921,2921,['Snickers' 'chocolate'],"Usually chocolate makes me hyper but my dog ate a pack of Snickers and he's been asleep for hours. Haha wake up so we can play, little guy."
2935,2935,['Counting Crows song' 'Omaha'],What is Peyton Manning's favorite Counting Crows song? Omaha
2937,2937,['Hungarian' 'drunk man' 'immigration officer'],"An immigration officer asks a drunk man if he's Hungarian he says ""yep, but my name's not Arian"""
2945,2945,['Kristen Stewart' 'vacuum cleaners'],Kristen Stewart was raised by a pair of vacuum cleaners
2955,2955,['Estate agents' 'chinesse'],Walk in closets Walk-In Closet Why do chinesse make such terrible Estate agents? Because non of the customers are ever comfortable with the idea of buying a house with a Hawk in the closet.
2968,2968,['wooden doors' 'wooden engine' 'wooden wheels'],"Did you hear about the car with wooden wheels, a wooden engine, and wooden doors? It wooden start"
2972,2972,['Tyrannosaurus' 'female tyrannosaur' 'male tyrannosaur'],"What do you get when you cross a female tyrannosaur with a male tyrannosaur? Tyrannosaurus Sex! *I apologize deeply, I'm so...so sorry*"
2974,2974,['coffee' 'women'],I broke up with my girlfriend because I like my women like I like my coffee Without other people's dicks in it.
2984,2984,['Feminists' 'feminists' 'zookeepers'],What do feminists and zookeepers have in common? Nothing. Feminists have nothing in common with anyone.
2989,2989,['Italian' 'Speech Impediment'],Italian Guy with a problem What do you call an Italian guy with one arm shorter than the other?  A Speech Impediment :)
2995,2995,['bar' 'termite'],"A termite walks into a bar... ... and says, ""Hey, is the bar tender here?"""
2999,2999,['Jesus' 'student loans'],It's a shock to me that people actually pay their student loans. That's a bill I gave to Jesus
3005,3005,['chiropractors' 'dinosaurs'],Turns out chiropractors aren't actually dinosaurs.
3016,3016,['Jewish mother' 'lightbulb'],"How does a Jewish mother change a lightbulb? ""No, that's all right. I'll just sit here in the dark."""
3017,3017,['erection' 'rectal thermometer' 'vet'],"As he inserted the rectal thermometer, I got a painfully hard and obvious erection... ""Maybe you should wait outside whilst I examine your dog,"" said the vet."
3019,3019,['New Years Day' 'caterpillar'],What does a caterpillar do on New Years Day ? Turns over a new leaf !
3021,3021,['camping' 'insurance'],"I was told if I got robbed when I was camping, it would invalidate my insurance... They said if my tent gets stolen, I'll no longer be covered."
3022,3022,['boomerang' 'dead cat'],What do you call a boomerang that doesn't come back when you throw it? a dead cat
3025,3025,['mail' 'speeding camera'],I just got a photo from a speeding camera through the mail... I just got a photo from a speeding camera through the mail. I sent it right back  way too expensive and really bad quality.
3029,3029,['pitchfork' 'tuning fork'],You stop bad music with a tuning fork. How do you stop bad singing? A pitchfork
3030,3030,['Trump supporter' 'google search' 'xen'],What happens when you call a Trump supporter xenophobic? They do a quick google search and then agree with you.
3032,3032,['Brutus' 'senate'],[March 15] Brutus: Going 2 the senate? Caesar: yeah u? Brutus: yep it'll be killer Caesar: how so? Brutus: like cool u know rad senate stuff
3034,3034,['Buddhist monk' 'hotdog stand'],What did the Buddhist monk say when he approached the hotdog stand? Make me one with everything.
3037,3037,['American brain' 'British joke' 'UK'],"UK /r/jokesters, tell me the most British joke you can think of. The less my American brain can comprehend it, the better!"
3040,3040,['Billy Mayes' 'diarrhea'],"I feel like my rear end turns into Billy Mayes whenever I get diarrhea... ""Butt wait, there's more!"""
3057,3057,['ISIS' 'polar bear'],Why did the polar bear join the terrorist group. Because that is where the ISIS.
3059,3059,['alcoholics' 'childhood'],I had a difficult childhood... I was brought up by a couple of alcoholics. I called them my Foster's parents.
3064,3064,['green' 'nun'],"A nun goes to the greengrocer, asking for a cucumber. ""Get 2"" he says. ""So you have one to eat"""
3070,3070,['NBA players' 'poultry'],Why do NBA players like poultry? Because they love to slam duck!
3075,3075,['Hillary Clinton' 'Obama'],"President Obama had lunch today with Hillary Clinton. Hillary told the president, ""After phoning my top advisers, I think I'll run for office."" And the president said, ""I know. I listened in."""
3077,3077,['dwarfs' 'midgets'],What do midgets and dwarfs have in common? Just a little
3083,3083,['gullible' 'oranges'],"If you say ""gullible"" slowly it sounds like ""oranges"" Weird huh?"
3084,3084,['Walter White' 'knock knock joke'],Why can't you tell Walter White a knock knock joke? Because HE is the one who knocks.
3085,3085,['ISIS' 'Samsung'],ISIS is taking back territory after a surprise turn of events. Their new partnership with Samsung is quickly paying off
3086,3086,['older Jewish folks' 'waiter'],"A waiter walks up to a table of older Jewish folks... A waiter walks up to a table of older Jewish folks while they are eating and asks: ""Is ANYTHING alright?"""
3088,3088,['bed sheets' 'tax brackets' 'thread count'],If you know the thread count on your bed sheets we're in different tax brackets.
3104,3104,['Nickelback' 'cr'],I play Nickelback real loud all day so crickets can listen to something annoying when they try to sleep
3120,3120,['Woods household' 'accident'],"Feel like Woods household right now is a bunch of people brainstorming, ""what is any other plausible reason for this accident?"""
3121,3121,['HETEROsapiens' 'HOMOsapiens'],"It's HOMOsapiens, not HETEROsapiens. It's the Bi-ble, not the Straight-ble."
3134,3134,['Exlax' 'viagra'],a friend took Exlax and viagra at the same time... .. he didnt know if he was coming or going.
3140,3140,['BBC period dramas' 'Downton Syndrome'],What do you call it when a person falls ill from watching too many BBC period dramas? Downton Syndrome
3144,3144,['NSA' 'Verizon'],"Pretty cool to think every time the Verizon guy said ""Can you hear me now?"" the NSA was quietly answering ""Yes we can."""
3147,3147,['Ryan Lochte' 'idiotic genius'],"What will Ryan Lochte say if he looses ""Dancing With the Stars""? ""I was robbed"" Sorry, that just came to me like a stroke of idiotic genius and I couldn't help myself."
3148,3148,['hiring manager' 'resumes'],"I am a hiring manager. Before I take a look at all the resumes, I throw the entire top half away. If you're going to be working for me, you also have to be lucky."
3149,3149,['hand dryers' 'space shuttle'],"""I guess we should make them sound like a space shuttle is taking off during an a-bomb explosion."" -person who invented hand dryers"
3150,3150,['blow job' 'eggs' 'meat' 'wife'],Q: Which of the following doesn't belong: wife  meat eggs blow job? A: The blow job. You can beat your wife your eggs or your meat; but you just can't beat a blow job.
3154,3154,['Dalai Lama' 'pizza shop'],The Dalai Lama went into a pizza shop.. And asked them to make him one with everything.
3156,3156,['Strayola' 'lost crayon'],What do you call a lost crayon? a Strayola
3157,3157,['kittens' 'puppies'],I love puppies and kittens and little cute hamsters But not all together. I don't like my food touching.
3158,3158,['asshat' 'cheeseball' 'feel'],"Ed Hardy makes a wine. Just tasted some. With full-bodied undertones of asshat, its repugnant mouthfeel would pair well with a cheeseball."
3177,3177,['internet' 'reddit'],My mommy used to warn me that there could be creepy people on the internet. But I'm not afraid anymore... Now that I'm on reddit I'm one of those people.
3182,3182,['Crest Toothpaste' 'prostitutes'],I've heard rumors that desperate prostitutes use Crest Toothpaste to reduce cavities.
3187,3187,"['Cheerios' 'Texas secession' 'interracial couple' 'non-English speakers'
 'pizza']",An interracial couple eating Cheerios and non-English speakers drinking Coke. We're a Benghazi pizza commercial away from a Texas secession.
3188,3188,['Iron Man' 'Iron Woman'],Iron Man is a super hero. Iron Woman is a command.
3189,3189,['coffee' 'women'],I like my coffee like I like my women In two enormous cups
3200,3200,['casino' 'craps' 'security'],I watched craps at the casino for over an hour tonight until security finally dragged me out of the bathroom.
3203,3203,['fired' 'stock trader'],"A recently fired stock trader said: ""This is worse than a divorce, I have lost everything and I still have my wife!"" "
3213,3213,['BlackBerrys' 'cancer' 'children'],I feel really sad for children with cancer and people who still use BlackBerrys.
3217,3217,['company fridge' 'tuna sandwich'],Strange new trend at the office People are putting names on food in the company fridge. Today I had a tuna sandwich named Kevin.
3220,3220,['Caitlin Jenner' 'transgender'],Caitlin Jenner isn't transgender. She's trans-Jenner.
3223,3223,['cross fitters' 'vegan' 'yoga'],"A vegan, cross fitters, and yoga person sit down for dinner And nobody says a word."
3226,3226,['meningococcal' 'ninja'],What does the ninja call his penis? meningococcal
3228,3228,['Martin Luther King Jr' 'Nelson Mandela' 'Rosa Parks'],"What did Martin Luther King Jr., Rosa Parks, and Nelson Mandela all have in common? They're all criminals."
3240,3240,['chinaman' 'dentist'],What times does the chinaman go to the dentist? Tooth-hurty
3241,3241,['Crocodiles' 'prehistoric beasts'],Crocodiles; these prehistoric beasts can grow up to 20 feet! Although most just grow 4.
3247,3247,['Friends' 'women'],"What do women call men who are shorter than 5'7""? Friends"
3248,3248,['Butt sex' 'spinach'],"Butt sex is a lot like spinach If you're forced to have it as a child, you probably won't like it as an adult."
3254,3254,['China' 'bounty hunter'],"I got a job as a bounty hunter in China. Couldn't believe my luck, every time they put a new wanted poster up, the guy they were after was standing right next to me!"
3258,3258,['tuna' 'tunafish' 'tunagiraffe'],"Why do people say tunafish, rather than just tuna? Is that to differentiate from the tunacow and tunagiraffe?"
3261,3261,['intelligence' 'sports fans'],"If 7 out of 10 sports fans have below average intelligence, what percentage of sports fans is that? 110%. [Aaaaaand we prove once again that morons are humorless. Really should know that by now.]"
3274,3274,['Targaryen girl' 'virgin'],What do you call a Targaryen girl who can outrun her brothers? A virgin.
3282,3282,['Shark Tank' 'feminine hygiene products'],They still won't let me on Shark Tank with my feminine hygiene products with Yo Momma jokes printed on 'em. That shit's racist.
3283,3283,['Christmas party' 'abortion'],That time of year again. Time to impregnate some chick at the office Christmas party and use my bonus to pay for the abortion. Pff holidays.
3291,3291,['Waitress' 'conch fritters'],"Me: Can I order the conch fritters please? Waitress: The ""ch"" is pronounced like a ""k"" Me: Okay Bick."
3294,3294,['Portugal' 'portugeeser'],What do you call an old person from Portugal? A portugeeser
3297,3297,['Waffle House' 'night shift'],What am I? What has six tits and three teeth? The night shift at the Waffle House.
3300,3300,['50 Cent' 'Zimbabwe'],"50 Cent Or as he's known in Zimbabwe, 400,000,000 dollars."
3312,3312,['Batman' 'Conditioner Gordon'],What does Batman use to wash his hair? Conditioner Gordon.
3316,3316,['School Joke Principal' 'teachers'],"School Joke Principal: ""I've had complaints about you, Johnny, from all of your teachers. What have you been doing?"" Johnny: ""Nothing, sir."" Principal: ""Exactly!"""
3318,3318,['Velcro shoes' 'jury duty'],I like jury duty because it's a fun reminder that one day my life could be in the hands of a guy wearing Velcro shoes.
3327,3327,['goat DNA' 'human DNA' 'petting zoo'],What do you get when you cross human DNA and goat DNA? Thrown out of the petting zoo
3330,3330,['Crete' 'Cretins'],What are the inhabitants of Crete called? Cretins!
3341,3341,['Olympics' 'synchronized drinking team'],In honor of the Olympics I suggest we start a synchronized drinking team..... Whose in?
3345,3345,['Autorickshaw Driver' 'Indians' 'James Bond'],"KILLER PJ for Indians! James Bond was travelling in an Autorickshaw Driver - Rs.7.50 hue Sahab .. Bond - Yeh lo 5 rupaye .. Driver - Lekin baki ke 2.50 ?! Bond - "" DHAI ANOTHER DAY "" :D :D"
3346,3346,['grilling' 'steaks'],My buddy is awesome at grilling steaks. They are all very well done
3348,3348,['alphabet soup' 'vowel movement'],"I ate five cans of alphabet soup yesterday. Then, I easily had the biggest vowel movement ever."
3355,3355,['Bob Marley' 'printer'],the printer in my office is fondly called Bob Marley it keeps jamming
3360,3360,['Diana' 'Tiger Woods'],What's the difference between princess Diana and Tiger Woods? Tiger Woods has a better driver
3369,3369,['ghosts' 'operating theatres'],What kind of ghosts haunt operating theatres? Surgical spirits.
3377,3377,['fire' 'firewood'],What's the difference between firewood and a jew? The firewood ain't been turned into ash yet.
3378,3378,['blind kid' 'geometry'],Why did the blind kid fail geometry? He didnt see the point.
