,Unnamed: 0,Topic,Joke
16,16,['Arnold Schwarzenegger' 'abortion clinic'],"What did Arnold Schwarzenegger say at the abortion clinic? Hasta last vista, baby."
19,19,['Miley Cyrus' 'Thanksgiving'],Thanksgiving joke What does Miley Cyrus eat for Thanksgiving? Twerky! Just kidding... Drugs. She eats drugs. -Adam Zopf @adamzopf
26,26,['Reserection' 'death' 'necrophiliac'],What happens to a necrophiliac after death? Reserection
32,32,['Thanksgiving Day' 'Walmart' 'trampled human corpses'],I am looking forward to 6pm Thanksgiving Day when Walmart opens its doors for its annual sale of trampled human corpses.
37,37,['Ibuprofen' 'headache medicine' 'reggae professor'],Ibuprofen is my favorite headache medicine that also sounds like a reggae professor.
57,57,['Mexican' 'fireman'],A Mexican fireman had twin boys He named them Jose and Hose B
60,60,['penis' 'testicles'],"Things have really turned around for me since I re-named my penis and testicles ""JD Power and Associates""."
62,62,['cat' 'toy mouse'],My cat just walked by me carrying a toy mouse I don't remember buying her. Women be shoppin!!!!!!!!!!!!!!!!!!!!!!!!!!!!!!!!!!!!!!!!!!!!!!!!!
65,65,['Bigfoot' 'ballet recitals'],"I don't believe in Bigfoot; because he never believed in me. I'd scan the crowd at my ballet recitals, and always see that one empty seat."
67,67,['color' 'gender' 'race' 'religion' 'sexuality'],"I don't judge people based on color, race, religion, sexuality, or gender...I base it on whether or not they're an asshole."
76,76,['dessert' 'hearing loss' 'women'],7% of all hearing loss is a result of sitting in a restaurant next to a table full of women who just received dessert.
78,78,['coffee' 'slaves'],I like my slaves like I like my coffee Fair Trade.
83,83,['Jenna Jameson' 'Oprah'],"Jenna Jameson to Oprah, ""There's a little bit of Jenna Jameson in everyone."" I'm pretty sure she got that backwards."
94,94,['Rapunzel' 'long hair'],Wanna hear a pun about long hair? Rapunzel.
96,96,['Donald Trump' 'Vagina'],What's the difference Donald Trump and my Vagina? One's a Cunt and the other has nice hair.
107,107,['Chicken' 'chicken' 'gay'],Chicken Why did the chicken cross the road? Why? To go to the gay guys house Knock knock Who's there? The chicken
109,109,['HIV' 'prostitute'],"I visited Amsterdam this summer, and decided to have sex with a prostitute. It was an overall positive experience. Sadly, it was an HIV positive experience."
111,111,['Alcohol' 'Lysol'],"Alcohol is like Lysol for feelings, it won't kill all of them."
117,117,['3rd wave feminist' 'pencil'],Who is better? The 3rd wave feminist or the pencil? The pencil is better. It has a point.
125,125,['Animal Crossing' 'KKK Slider'],What do you call a racist dog from Animal Crossing? KKK Slider
127,127,['US government' 'college student'],"It's comforting to know that the US government works the same way as a college student when it comes to deadlines... They both wait until the last minute, then get an extension."
135,135,['China' 'labels'],"In China the labels read, ""Made by someone you know."""
138,138,['Descartes' 'bartender'],"Descartes walks into the bar. The bartender asks him, ""will you have your usual tonight?"" Rene replies ""I think not"" and he disappears."
140,140,['earthquake' 'television doorbell'],My dog can predict when an earthquake is going to happen. But television doorbell versus actual doorbell baffles him every time.
146,146,['Frisbae' 'frisbee'],What do you call a frisbee that's more than a friend? Frisbae
149,149,['retarded girl' 'virginity'],I lost my virginity to a retarded girl last night. I wanted it to be special
154,154,['masturbation addiction' 'sex addiction'],"I once had a crippiling masturbation addiction... ...now i have a sex addiction, could you say my addiction has gotten out of hand?"
160,160,['comments section' 'flyover states'],Instead of calling them flyover states we should call them comments section.
164,164,['Breaking Bad' 'family life'],Breaking Bad is my favorite documentary about what it takes to be an entrepreneur while balancing family life.
165,165,['black cat' 'four leaf clover'],My black cat just ate my four leaf clover. That can't be good.......
170,170,['DNA' 'hillbilly murders'],Why are hillbilly murders hard to solve Because they all share the same DNA
172,172,['Angela Merkel' 'President Obama'],"Dear President Obama, I've got a joke for you... I texted it to Angela Merkel. Did you... *get it*?"
182,182,['Bach' 'chiropractor' 'composer'],Why did the composer go to the chiropractor? Because he had Bach problems
183,183,['Batman' 'MOTHMAN' 'SUPERMAN'],[Justice League HQ] SUPERMAN: Looks like Batman is hungry tonight MOTHMAN: [visibly sweating] I think I'll just fight daytime crimes
184,184,['Greece' 'Turkey'],If we attacked Turkey from the rear... ...do you think Greece would help?
185,185,['drum' 'sheep' 'snake'],"A sheep, a drum and a snake fall down a cliff badum tss"
186,186,['snigger' 'sracist'],My favourite word is snigger It allows me to be sracist without speople sthinking I'm a sbad sperson
187,187,['elephant' 'fridge'],How do you hide an elephant in a fridge? You remove his slippers and open the door . You put him inside. You close the door and take the slippers away.
190,190,['Arnold Schwarzenegger' 'gym manager'],What did Arnold Schwarzenegger say to the gym manager when he was joining a new gym? I'll re-rack.
192,192,['baby shower' 'women'],"Right now a group of women at a baby shower are simultaneously saying, ""Awwww..."" while some knocked up chick holds up a tiny pair of socks."
195,195,['anaesthetist' 'operation'],"I went in to hospital for an operation... I asked the anaesthetist if I could administer the needle myself, and he said: ""Sure, knock yourself out""."
200,200,['Mutton Looter King' 'royalty' 'sheep stealer'],What do you get when you cross a sheep stealer with royalty? Mutton Looter King
201,201,['Indian redditor' 'arranged marriage'],"An Indian redditor gets an arranged marriage. He turns to his partner and says: ""Thanks for the gold, kind stranger!"""
210,210,['Profile Pic' 'Shirtless Guy'],"Dear Shirtless Guy in his Profile Pic, You REALLY want to impress girls? Get a job & pose in front of your cubicle."
211,211,['Conservatives' 'IRA' 'Irish reunification'],The IRA have been fighting for Irish reunification since the 70s. . . All they needed to do was vote for the Conservatives.
217,217,['Facebook' 'Instagram' 'app'],Facebook buys Instagram for one billion?!? Idiots!! They could have downloaded it from the app store for .99 cents..
221,221,['giraffe' 'zebra'],"[sees a zebra for the first time] What's up with that horse? [sees a giraffe for the first time] Okay, what the hell is going on today?"
226,226,['children' 'women'],Why are women and children evacuated first in a disaster? So we can think about a solution in silence
228,228,['Glenn Frey' 'pneumonia'],Some people say Glenn Frey got pneumonia from the cold... But that can't be true because he said the Heat is On.
232,232,['Mexican gang member' 'earthquake'],"What did the Mexican gang member say when two large houses fell on him during an earthquake? Get off me, homes."
236,236,['mayonnaise' 'refrigerator'],What does the mayonnaise say to the refrigerator? Shut the door im dressing
247,247,['facebook' 'profile'],"I wonder if dog's had facebook, would they put our picture as their profile picture."
248,248,['Native Americans' 'strippers'],"Why are Native Americans the most successfull strippers? Because when they dance, they make it rain."
250,250,['Africa' 'Ebola Patient'],Why Did the Ebola Patient Cross the Road? Trick question. There are no roads in Africa.
253,253,['blind' 'nudist colony'],How do you find a blind man in a nudist colony? It's not hard
257,257,['atheist' 'crossfit fanatic' 'vegan'],"An atheist, a vegan, and a crossfit fanatic walk into a bar... Who talks more?"
260,260,['agnostic' 'dyslexic' 'insomniac'],"What do you get when you cross an insomniac, agnostic and a dyslexic? Someone who stays up all night wondering if there is a Dog."
264,264,['Stephen Hawking' 'voice mail messages'],I left Stephen Hawking like 8 voice mail messages before I realised he'd picked up every time.
269,269,['gas station' 'windscreen wipers'],"So a Trabi owner pulls up to a gas station... ...and says to the attendant: ""Two windscreen wipers for my Trabi please."" The attendant replies: ""That sounds like a good deal!"""
273,273,['Luftwaffles' 'nazi pilots'],What did nazi pilots eat for breakfast? Luftwaffles
277,277,['Tyler Perry movies' 'dark comedies'],Why aren't Tyler Perry movies for the light-hearted? They're dark comedies.
278,278,['rear' 'woman'],Every woman I've ever been with only saw me the way they wanted to see me... ...in their rearview mirror.
280,280,['America' 'prostitute'],"How do you figure out which contestant in a Ms. America pageant is a prostitute? Look for the one with the sash that says ""I da ho""."
283,283,['Google search history' 'Mole' 'homemade bombs'],[Google search history] Moles How to kill moles How to make homemade bombs Rescue moles from cave-in Dealing with regret Mole stew
294,294,['Orange Julius' 'mimosas'],"Orange Julius is the third best thing to happen to oranges behind mimosas and the ""orange you glad I didn't say banana"" knock knock joke"
301,301,['hamburgers' 'vampires'],Do hamburgers make good vampires? No because they always find themselves in ghoulash situations!
303,303,['Tom Cruise' 'movie ticket'],I paid 10.50 for a movie ticket to watch Tom Cruise die continuously for 2 hours. I would have paid a hundred dollars to watch that.
309,309,['Alabama' 'stab wounds' 'suicide'],They just found a Black guy hanging from a tree with 79 stab wounds in Alabama.... The police say it's the worst case of suicide they've ever seen
320,320,['internal temperature' 'tauntaun'],What is the internal temperature of a tauntaun? Luke warm
336,336,['JJ sized breasts' 'car accident' 'motorboating accident'],A woman's JJ sized breasts saved her life in a car accident. Those same breasts were the cause of her husbands death in a motorboating accident.
338,338,['batman toys' 'kids'],"[date gets back from the bathroom] those batman toys in the tub are so cute! How old are your kids? ""kids?"""
339,339,['Google' 'Nicolas Cage jokes'],"I just Googled 'Nicolas Cage jokes' and it showed me a list of every film he's been in. Well played, Google."
340,340,['Pandora' 'official'],"I've been listening to the official workout station on Pandora for 3 months and I'm still fat, I'm calling bullshit."
346,346,['lacerations' 'surprise vomit piles'],Do you hate yourself? Do you wish someone would trip you down stairs? Do you enjoy lacerations & and surprise vomit piles? *hands you a cat*
350,350,['clean laundry' 'semen' 'washer'],"Why was there semen on the clean laundry? When Greg woke up, his mom had left a note reading, ""Please put a load in the washer"""
367,367,['Chinese conga line' 'Chu Chu train'],What do you call a Chinese conga line? A Chu Chu train
368,368,['Cinderella' 'Miscarriage'],Why was pregnant Cinderella late to the ball? Miscarriage
371,371,['Dateline' 'dating show'],*watching Dateline* wow this is the worst dating show ever
374,374,['rabbits' 'wild dogs'],"Two rabbits were being chased by a pack of wild dogs... One says to the other ""should we stop and outnumber them?"" ... &amp;nbsp; ""keep running you fool we're brothers!!"""
375,375,['gay magazine' 'poofreader'],I just got a new job at a gay magazine. I'm a poofreader.
376,376,['Mexican food' 'Spanish accent'],No one is more unnecessarily confident than a white person that just ordered Mexican food in a Spanish accent.
379,379,['doctor' 'rectal thermometer'],"A doctor reaches into his pocket and finds his rectal thermometer He says ""Shit, some asshole took my pen!"""
392,392,['checkup' 'semen sample' 'stool sample' 'urine sample'],"At my last checkup the doctor said he needed a urine sample, a semen sample and a stool sample ... ... I said "" Doc, I can speed this along - I'll just leave you my underwear !"""
393,393,['acoustic guitar' 'funeral' 'widow'],[pulls out acoustic guitar at a funeral] alright everyone stop being all [finger quotes] sad this next 1 is dedicated to a very sexy widow.
396,396,['cum' 'gay guys'],"If there are three gay guys in a bath and a lump of cum floats to the surface, what do they say? Who farted?"
401,401,['gay job interviewer' 'homeless person'],What did the homeless person say to the gay job interviewer when asked for his address? No home-o.
403,403,['Cantaloupe' 'fruit'],What type of fruit is not allowed to get married? Cantaloupe...
404,404,['coffee' 'women'],I like my women like I like my coffee... I don't fucking like coffee.
408,408,['Chinatown' 'Erection Day'],Heading to Chinatown after work... I heard it's Erection Day.
418,418,['brown eyes' 'mailman'],"I didn't see mommy kiss Santa, but my sister saw her kiss the mailman, which explains why I'm the only one with brown eyes in the family"
419,419,['circus' 'clown' 'vampire'],Why did the vampire attack the clown? He wanted the circus to be in his blood.
432,432,['laundromat' 'period underwear'],"""911, what's your emergency?"" Me: A cute guy at the laundromat walked past me while I was folding my period underwear."
441,441,['coyote' 'police'],"[wife looking at pictures of my dead body with police] ""why isn't he wearing a shirt"" we believe he removed it when he challenged the coyote"
452,452,['priest' 'silver medalist'],how are a silver medalist and a priest alike They both came in a little behind
455,455,['conspiracy theories' 'homeless guy'],Saw a homeless guy babbling about conspiracy theories that doesn't really make sense... You could say it was a vague rant.
458,458,['holiday plans' 'late term abortion'],Don't judge me because I like 80's music. Judge me because I had a late term abortion because a baby would ruin my holiday plans.
461,461,['bartender' 'infectious disease'],"An infectious disease enters a bar... the bartender says,""we dont serve your kind here"". The disease replies, ""well you're not a very good host!"""
470,470,['Assassins Creed Movie Trailer' 'Spanish Inquisition'],I just saw the Assassins Creed Movie Trailer... I did not expect The Spanish Inquisition.
471,471,['Canadians' 'hockey game'],Why do Canadians do it doggy style? So they can both watch the hockey game.
481,481,['house party' 'kids'],"Keep in mind that ""The Cat in the Hat"" is a lesson to your kids on how to throw a house party when you're gone..."
494,494,['Acne' 'Catholic priest' 'acne'],Difference between priest and acne? What is the difference between a Catholic priest and acne? Acne waits until puberty to come on a kid's face.
497,497,['Neverland' 'children' 'locksmith'],Since Michael Jackson's death hundreds of children have gathered at the gates of Neverland. Police have said that they will let them out once they find a locksmith. - http://ww.key-n-lock.com
500,500,['gay men' 'gerbils'],Why do gay men always have candles near their asses? So the gerbils can find their way out.
518,518,['Africa' 'Ethnic Cleansing'],I've decided to make an all-natural shampoo made from roots found in Africa. I'll call it Ethnic Cleansing.
522,522,['Catholic priest' 'zit'],Nsfw Whats the difference between a Catholic priest and a zit? The zit waits untill you're 12 to come onto your face.
523,523,['Mexican restaurant' 'tortilla chips'],True: If you don't eat a whole basket of tortilla chips before your entree arrives in a Mexican restaurant it means you don't love your mom.
525,525,['circus' 'clown'],"A clown at the circus got tomato thrown at him from the audience, he turns and says HAY, THATS NOT FUNNY"
534,534,['Redditor' 'Upvote whore'],What Did the Upvote whore say to the Redditor? I'll suck yo dick for a Upvote
543,543,['melons' 'weddings'],Why do melons always have big weddings? Because they can't elope.
545,545,['Iforgotto' 'coffee drink'],What is the preferred coffee drink of people with alzheimer's? The Iforgotto
547,547,['crust' 'dirty bus stop' 'voluptuous lobster'],What's the difference between a dirty bus stop and a voluptuous lobster? One's a crusty bus station and the other's a busty crustacean. :D edit: funnier when said aloud
548,548,['capital letters' 'one arm typist'],I just got a job helping a one arm typist do capital letters... Its shift work.
550,550,['chickens' 'crows'],What do you call a group of chickens dressed up like crows? A murder most fowl. (I'll see myself out...)
552,552,['Catholic child abuse' 'Italians' 'Spaniards'],Italians and Spaniards are so used to Catholic child abuse... ... That they call the Pope daddy
572,572,['holidays' 'panhandlers'],Republicans help the poor during the holidays by sending 50 one buck at a time to panhandlers on the  street.
585,585,['64' 'n'],The nintendo 64 turned 18 last month Which means you can now legally blow the cartridges
590,590,['Beef stroganoff' 'masturbating cow'],What do you call a masturbating cow? Beef stroganoff.
593,593,['bartender' 'mushroom'],"A mushroom walks into a bar The bartender says: ""Get out of here! We don't serve your kind here."" The mushroom says: ""Why not man? I really am a FunGi."""
597,597,"['Starbucks' ""Victoria's Secret""]",Starbucks really isn't that expensive when compared to what Victoria's Secret charges per cup
598,598,['Belgium' 'Brusselsprouts' 'little kids'],What do you call little kids in Belgium? Brusselsprouts
607,607,['masochist' 'sadist'],"A sadist and a masochist meet The masochist starts pleading, ""Hit me! Please hit me!"" The sadist looks at him, smiles, and calmly replies, ""No."""
609,609,['Bernie Sanders' 'Libertarian Presidential Candidate'],"Libertarian Presidential Candidate's new Campaign, inspired by Bernie Sanders. ""Feel the Johnson"""
628,628,['alphabet' 'pirates'],Why does it take pirates so long to learn the alphabet? Because they could spend years at C.
629,629,['Republicans' 'Starbucks cups'],"There's a 100% chance the Republicans will discuss Starbucks cups in a debate tonight, so remember that when they ask how they lost in 2016."
631,631,['mutiny' 'orgasm' 'seamen'],What do mutiny and an orgasm have in common? A sudden surge of seamen.
639,639,['drug dealer' 'hooker'],What is the difference between a drug dealer and a hooker? A hooker can wash her crack and sell it again.
644,644,['greek dips' 'hummusexual'],I get turned on whenever I eat greek dips... ...I think I'm a hummusexual.
648,648,['Disney headquarters' 'Tasers' 'security guards'],I showed up at Disney headquarters uninvited I said I was there for a Rogue One cameo That's how I learned the security guards have Tasers
649,649,['coffee' 'women'],I like my women like I like my coffee... [Fill in the blank]
659,659,['Mall security guards' 'handcuffs'],Today I learned two things: 1. Build-A-Bear Workshop only lets you stuff fake animals 2. Mall security guards get to use real handcuffs
660,660,['animal kingdom' 'elephants'],Why do elephants have 4 feet? Because in the animal kingdom 6 inches just wont do
676,676,['NON-handicapped parking spaces' 'WHITE history month'],Why don't they have a WHITE history month?? Why don't they have NON-handicapped parking spaces? Why's there no cemetery for ALIVE people??
680,680,['pizza buffet' 'vegetarian pizza'],"*at a pizza buffet in the Midwest* Me: excuse me, can you please make a vegetarian pizza? Him: Sure! What kind of meat do you want on that?"
681,681,['Reddit' 'blonde jokes' 'punch lines'],"Jokers of Reddit, any good blonde jokes or punch lines out there?"
684,684,['Router Limits' 'WiFi signal range'],What is it called when you are on the edge of WiFi signal range? Router Limits!
686,686,['Vegans' 've' 'vegan'],Year 2142: Meat eaters have died out. Vegans survive. 2143: Everyone is dead b/c the vegans couldn't tell anyone else that they were vegan.
690,690,['Irishmen' 'black' 'police notice board'],"Go to racist joke, what's yours? Two unemployed Irishmen walk past a police notice board with ""two black men wanted for rape"" first one says ""fucking niggers get all the best jobs"""
691,691,['burglars' 'family pictures' 'home alarm'],"If you believe the home alarm commercials, the first thing burglars do when they break into your home is smash your family pictures."
698,698,['cats' 'internet'],Scientists remain baffled as to why the people on the internet really like pictures of cats and cats doing things.
699,699,['cannon balls' 'elephants' 'marbles'],What do you do with old cannon balls ? Give them to elephants to use as marbles !
701,701,['Saturn' 'anus'],Why is Saturn like your balls?? Because it is in between jupeter an your anus.
706,706,['MIa Khalifa' 'Wiz Khalifa'],I tried googling Wiz Khalifa ... But all I found was MIa Khalifa peeing .
707,707,['balloon animals' 'pickle'],I am an expert at making balloon animals. May I interest you in a hyphen or a pickle?
709,709,['Iranian Ossetra caviar' 'penis' 'wild'],What's the difference between wild Iranian Ossetra caviar and my penis? One is a delicacy (Deh-Lih-Cuh-See) and the other is a delicady (Deh-Lih-Cuh-Dee) Edit: The D
710,710,['Oprah' 'black women'],Who are the 3 most famous black women? 1. Oprah 2. Aunt Jamima 3. Motha Fucka
721,721,['Taliban' 'break'],You can't keep eating people's lunches from the break room & blaming the Taliban. A lot of what you've been stealing is pork for one thing.
726,726,['Donner Party Diet' 'Franks' 'Jacks' 'Patties'],The Donner Party Diet Breakfast: Jacks Lunch: Franks Dinner: Patties
733,733,['Tetris highscore' 'wife'],Why is my Tetris highscore like my wife? I beat both of them for fun.
735,735,['ancient' 'bisexual Norse monarchs' 'motorcycle gang'],What do you call a motorcycle gang made up of ancient bisexual Norse monarchs? The bikings.
736,736,['Bloody Mary' 'Honest Abe'],"They called their son Honest Abe, because he was honest. They called their daughter Bloody Mary..."
744,744,['Honor Guards' 'light bulb'],Q: How many Honor Guards does it take to screw in a light bulb? A: 22 one to screw it in 21 to shoot the bulb.
746,746,['China' 'Coldplay concert'],Did you hear about the Coldplay concert in China last weekend? It was all yellow.
749,749,['liquid soap' 'prison inmates'],Why don't prison inmates just use liquid soap?
758,758,['Micro Phelps' 'bacteria'],What do you call bacteria that can swim fast? Micro Phelps.
764,764,['Barbie doll' 'Funeral Home Barbie' 'hearse coffin'],There is a new Barbie doll on the market - Funeral Home Barbie ...complete with hearse coffin and kicky little shroud
770,770,['drum set' 'son'],I repaired my drum set after my son broke it... ... ... Now he has to deal with the repercussions.
774,774,['Facebook' 'internet'],"If you're reading this you're probably addicted to the internet. And by internet, I mean Facebook."
775,775,['Hotel California' 'Yelp'],Hotel California is basically a negative Yelp review with a two minute guitar solo.
777,777,['3 piece suit' 'african american'],What do you call an african american in a 3 piece suit? The defendant.
778,778,['German' 'sour Kraut'],What do you call a German with a bad attitude? A sour Kraut.
780,780,['21 gun salute' 'Bali 9'],"I think it is wrong that the Bali 9 get a one minute silence I mean, they already got a 21 gun salute."
785,785,['irony' 'sarcasm'],The only thing better than sarcasm... is irony.
789,789,['midget' 'venereal disease'],What's the difference between a midget and a venereal disease? One's a cunning runt and the other's a running cunt.
790,790,['crossing guard dad' 'human trafficking'],[dinner table] gfs dad: so what do you do for a living me: human trafficking *he chokes* gf: he's a crossing guard dad
791,791,['Sparky' 'short legs' 'steel balls'],What do you call a dog with short legs and steel balls? Sparky
800,800,['feminist' 'mail' 'post office'],Why did the feminist refuse to work at the post office? Because it was a mail dominated industry
810,810,['Star Wars' 'drug smuggler' 'religious fanatic'],"Star Wars (1977, PG) a group of terrorists enlist the aid of a drug smuggler and a religious fanatic to bomb the seat of governmental power."
816,816,['TIFU' 'gym membership'],"TIFU when I deleted my gym membership, hit my lawyer, &amp; posted it to Facebook."
817,817,['Bellhop' 'hotels' 'rabbits'],What job do rabbits at hotels have?  Bellhop.
822,822,['snail' 'turtle'],What did the snail say when he was riding on the back of the turtle? Weeeeeeeeee
824,824,['cologne' 'credit card'],My son got me some very expensive cologne for Father's Day. I know it was very expensive because he used my credit card.
828,828,['fiancee' 'nihilist'],"How does a nihilist propose to his fiancee? ""Even though my existence is meaningless I want to spend the rest of it with you."""
830,830,['Jews' 'Santa'],What's the difference between Jews and Santa? Santa goes down the chimney.
832,832,['busboy' 'pub manager'],"The pub manager is showing the new busboy around the kitchen, when they come to two doors. The busboy asks, ""Which one is the 'in' door?"" ""Let me show you"", says the manager, and 'e walks in."
840,840,['Rolling Stones' 'The Walking Dead'],I thought The Walking Dead was having a special tonight.... Turns out it was just The Rolling Stones performing at the 12/12/12 concert.
842,842,['leprechaun' 'priest' 'rabbi'],"A priest, a rabbi and a leprechaun walk into a bar. The leprechaun says, ""Bejesus, I'm in the wrong joke!"""
849,849,['google history' 'llama'],"According to my google history, I spent most of last night trying to buy a llama."
851,851,['Canada' 'Nova Scorcha'],What do you call a hot day in Canada? A Nova Scorcha!
853,853,['old maid' 'vasaline'],What did the old maid get the vasaline for? 84 cents. Joke by my grandfather
864,864,['Sue' 'female lawyer'],What is a name for a female lawyer? Sue
866,866,['Bluetooth' 'toothbrush'],What Is Bluetooth ? When your toothbrush stops working mid brushing
