,Unnamed: 0,Topic,Joke
6535,6535,['slightly drunk woman' 'wedding video'],"A slightly drunk woman is watching tv... She yells, ""Don't go there! Don't go up the stairs! Don't go into the church you dumb bitch!"" Her husband asks, ""What are you watching?"" ""Our wedding video."""
6548,6548,['Hava Nagila' 'Klezmer music'],"Why is Klezmer music so addictive? Once you Hava Nagila, you'll want another!"
6550,6550,['blackjack scale' 'women'],"We should really use the blackjack scale to rate women. For example: ""Every girl here is ugly"" ""Well, what about her? "" ""Eh, she's like a 15 or 16. Not sure if I'd hit it"""
6553,6553,['ceremony' 'reception'],"Two antennas met on a roof... they fell in love, and decided to get married. The ceremony wasn't great, but the reception was excellent."
6561,6561,['children' 'ten Chin deficit disorder'],What happened to Mr. Chin after all 10 of his children disappeared? He developed a ten Chin deficit disorder.
6562,6562,['pigs' 'precinct'],What do you call a group of pigs? A precinct.
6568,6568,['bluegrass musicians' 'light bulb'],Q: How many bluegrass musicians does it take to screw in a light bulb? A: Two. One to screw it in and one to complain that it's electrified.
6572,6572,['Einstein' 'general relativity'],I wonder if Einstein thought of his theory of general relativity... in New York's Time Squared...
6573,6573,['Spain' 'equal rights' 'fascist government' 'women'],This day in history. 1961. In Spain the fascist government of Generalissimo Francisco Franco declared equal rights for women and men. None.
6583,6583,['360 hoscope' 'hooker'],What do you call a hooker that was shot by a sniper? 360 hoscope
6593,6593,['Obama' 'Thanksgiving' 'racist'],I wonder if racist families have that one liberal uncle who gets drunk at Thanksgiving and goes on about how Obama is DEFINITELY American.
6596,6596,['Norwegian' 'Swede'],Whaat do you get when you cross a Swede and a Norwegian? A socialist who wants to be king!
6602,6602,['Satan' 'Xmas letters' 'dyslexic kids'],I wonder if Satan ever gets tired of getting Xmas letters from dyslexic kids.
6607,6607,['Quinn' 'bullying'],Anita Sarkeesian and Zoe Quinn walk into the UN.. Then proceed to lecture them on bullying.
6610,6610,['Ribbit' 'spelling bee'],[at a spelling bee] Judge: Your word is SPELL. Witch: *mumbles something under her breath* Judge: Ribbit
6613,6613,['atheist' 'subway'],Can't be an atheist after getting in a subway car with no a/c because u now know hell is real
6618,6618,"['Christians' 'IRS' 'Jews' 'Muslims' 'Westboro Baptist Church' 'jihadists'
 'religion']","Every religion has violent people... ... The Christians have The Westboro Baptist Church, the Muslims have the jihadists, and the Jews have the IRS"
6636,6636,['Heidi Montag' 'Mary Shelley'],That's pretty cool that Mary Shelley wrote Heidi Montag's biography before she was even born. #Frankenstien
6658,6658,['Jesus' 'Norse gods' 'frost giants'],"Jesus said that he'd get rid of evil people, whereas Norse gods said they'd get rid of frost giants. nnI don't see many frost giants around."
6659,6659,['Jacques Cousteau' 'Natalie Portman'],"If Natalie Portman dated Jacques Cousteau they would win celebrity couple nicknaming forever with ""Portmanteau."""
6661,6661,['Charlie Sheen' 'barfight'],Charlie Sheen walks into a bar... And orders a drink or two. Or three. Or four. And then gets into a barfight.
6666,6666,['cantelopes' 'hookers' 'mountain lions'],"Where do guys who buy hookers, mountain lions, and cantelopes go for the summer? John Cougar Meloncamp An old joke I haven't heard in ages."
6675,6675,['heir conditioner' 'hypnotist'],What do you call a hypnotist that works with wealthy children during the summer? an heir conditioner.
6681,6681,['aux pas' 'f' 'stepdads'],"The fact that we're not calling stepdads ""faux pas,"" seems like a missed opportunity."
6682,6682,['blow job' 'blowjob' 'eggs' 'meat' 'wife'],"Pick the odd one out... Pick the odd one out: eggs, meat, wife, blowjob. You can beat your eggs, you can beat your meat, you can beat your wife, but you can't beat a blow job"
6684,6684,['Empire Strikes Back' 'Star Wars movie'],Why is Empire Strikes Back the best Star Wars movie? It's a perfect 5/7.
6707,6707,['barbecues' 'hamburgers'],Why do hamburgers feel sad at barbecues? They get to meet their old flames!
6713,6713,['elephant' 'naked man'],"What did the elephant say to the naked man? ""How do you drink through that?"""
6715,6715,['Hogwarts' 'sorting hat'],"Yo mama so fat, when she went to Hogwarts for the first time, the sorting hat said ""Awwwwww hell 'naw!!"""
6724,6724,['Whole Foods' 'baguettes'],"There is a time and a place for accosting people with baguettes (2 p.m., Whole Foods)."
6730,6730,['Hitler' 'Trump'],Whats the difference between Trump and Hitler? About 70 years
6745,6745,['Klondike' 'lesbian Eskimo'],What do you call a lesbian Eskimo? A Klondike.
6749,6749,['Chuck Norris' 'grizzly bear carpet'],Chuck Norris has a grizzly bear carpet in his room The bear isn't dead it is just afraid to move.
6751,6751,['Pixar collection' 'Rick Astley'],Rick Astley will let you borrow any movie from his Pixar collection except one... ...he's never gonna give you *Up.*
6753,6753,['Tardis' 'yoga pants'],I saw 300 lbs crammed into a pair of small yoga pants so now I understand how the Tardis on Dr. Who is real.
6756,6756,['beastiality' 'necrophilia'],"I'm recovering from necrophilia and beastiality... I would tell you about it, but I'd be beating off a dead horse."
6762,6762,['chicken' 'egg'],"Which came first the chicken or the egg? The chicken of course, an egg cannot cum! Made this up in my sleep sorry if offends any egg lovers.."
6775,6775,['college kids' 'horror movie'],"You know you're old when you watch a horror movie where annoying, partying college kids get murdered and you identify with the killer."
6783,6783,['Switzerland' 'flags'],Whats the best part of living in Switzerland? Im not too sure either but the flags a big plus.
6798,6798,['Batman' 'Robin'],What did Batman say to Robin before they got in the car? Get in the car Robin
6801,6801,['pregnant woman' 'threesomes'],"I asked a pregnant woman if she would have sex with me. She said ""no, I don't do threesomes""."
6814,6814,['Indian flowers' 'Patels' 'facebook post'],What do Indian flowers grow? Patels (this may or may not have been inspired by a dumb facebook post I saw)
6821,6821,['children' 'pistachios'],Shout out to the sense of wonder in the eyes of children. Also to pistachios. I'll eat a shit ton of pistachios. Mmmm pistachios.
6823,6823,['Daisy van' 'minivan'],"I asked my 3yo daughter if I should get a minivan... She said, no, you should get a Daisy van."
6830,6830,['high school' 'police force' 'volley ball team'],The local high school volley ball team was having a game against the police force. It was time for the police to protect and serve.
6832,6832,['Johnny Depp' 'Tim Burton'],Johnny Depp is to Tim Burton what Tyler Perry is to Tyler Perry.
6833,6833,['blind woman' 'stapler'],Q: How did a blind woman pierce her ear? A: Answering the stapler.
6845,6845,['OC' 'Reddit' 'crowdsource' 'defective condoms'],I'm turning to Reddit to help crowdsource an OC joke about defective condoms but it's all been a bust. You pricks keep poking holes in it.
6846,6846,['poverty' 'world hunger'],How do you solve world hunger and poverty simultaneously? By feeding the poor to the hungry.
6851,6851,['Atlantic Ocean' 'Columbus'],What bus crossed the Atlantic Ocean? Columbus
6862,6862,['cherry cokes' 'crisps' 'kit kats'],"There was a new machine at the gym today. I had to stop using it after an hour as i felt sick, but it was worth it got through 4 kit kats 2 cherry cokes and 2 packets of crisps."
6863,6863,['SoCRAYtes' 'Socrates' 'keg stand' 'philosopher frat party'],It's 450 BC. Socrates is doing a keg stand at a philosopher frat party. Gets the nickname SoCRAYtes. Nobody takes him seriously ever again.
6869,6869,['alligator' 'bartender' 'lawyers'],"A guy walks into a bar and asks ""Do you serve lawyers?"" The bartender responds ""Yes, of course!"" The man then says ""Well then. I'll have a beer for myself and a lawyer for my alligator."""
6871,6871,['Brazil' 'suicide emergency hotline number'],What is the suicide emergency hotline number in Brazil? 127 Edit: [for clarification](http://www.fifa.com/worldcup/matches/round=255955/match=300186474/)
6872,6872,['buffet coupon' 'police sketch artist'],"*describes my ideal woman to police sketch artist* ""And I need you guys to find her by 9 tonight cuz this buffet coupon is about to expire."""
6877,6877,['golf' 'tennis'],"""Can I get a do-over?"" - Me, playing golf, tennis (or pretty much any sport), taking a test, having sex, making a speech, living my life...."
6881,6881,['mutant' 'sex'],Did you hear about the mutant that had a sex change? She's an Ex-Man
6883,6883,['Pirates' 'pilates' 'workout program'],What's a pirate's favorite workout program? Pirates (pronounced like pilates)
6891,6891,['Strawberries' 'pink lemonade'],Do you know what makes pink lemonade pink? Strawberries.
6893,6893,['America' 'knock knock jokes'],Why aren't there any knock knock jokes about America? Because Freedom Rings.
6896,6896,['Jack' 'women'],Experience with women has taught me that Jack was most likely pushed down the hill.
6900,6900,['Public Restroom' 'toilet paper'],"Hello. I am Public Restroom. Would you like some toilet paper that melts in the palm of your hand? Here, have some empty soap, my child."
6906,6906,['coloring book' 'elephant' 'little girl'],The unused coloring book. Why can't the little girl color the elephant in her coloring book? Her arms are amputated.
6907,6907,['Germany' 'far right party'],A far right party wins an election in Germany with 60% of the vote. I did nazi that coming
6910,6910,['fishing' 'woman'],"Did you hear about the 6 guys and the woman that went fishing? The guys didn't catch anything, but the woman came home with a red snapper."
6914,6914,['Chocolate Cracker' 'Michal Jackson'],What is Michal Jackson A Chocolate Cracker (if they exist)
6916,6916,['Cincinnati Reds' 'hamburger fans'],Which baseball team is currently the favourite  with hamburger fans? The Cincinnati Reds -because they're the Big Bread Machine!
6922,6922,['Brazilian wax' 'barber'],How does a barber avoid getting hair in his food? By giving her a Brazilian wax first!
6924,6924,['Jimmy Savile' 'Michael Jackson'],What do Michael Jackson and Jimmy Savile have in common? they touched some many lives
6934,6934,['diarrhea' 'epilepsy' 'oyster' 'prostitute'],"What's the difference between an oyster with epilepsy and a prostitute with diarrhea? Well, one you shuck between the fits and the other..."
6939,6939,['Instagram' 'Michael J Fox'],I added Michael J Fox as a friend on Instagram... He likes every single one of my photos.
6942,6942,['Jeffrey Dahmer' 'Peewee Herman'],What does Jeffrey Dahmer and Peewee Herman have in common? They were both caught with hands in their drawers.
6944,6944,['Att' 'selfies' 'women'],"Attractive women post selfies and refer to themselves as ugly. As a group, if we begin agreeing with them we could stop that shit quick."
6957,6957,['Reeces Pieces' 'colored candy shells' 'peanut butter'],I have a theory that consuming little bits of peanut butter encased in colored candy shells provokes silly rhymes. I call it my Reeces Pieces Thesis. . . . . I'll see myself out.
6958,6958,['American Idol' 'Pitbull'],"Fox has cancelled American Idol. From Now on, if I want to listen to bad music, I'll have to listen to Pitbull just like everyone else."
6959,6959,['divorce' 'wedding'],CW: My wedding is going to be expensive! Me: Wait till you see what the divorce is going to cost you!
6971,6971,['coffee' 'hipster'],Why did the hipster burn his tounge on his coffee? Cus he drank it before it was cool...
6974,6974,['hareplanes' 'rabbits'],How do rabbits fly? In hareplanes.
6989,6989,['Pope' 'cardinals' 'election'],"I wonder during the election for Pope, did the other cardinals point to the losers and say excitedly ""you are NOT the  father"""
6999,6999,['passion fruit tea' 'tampon'],My tampon just leaked during my bath and now it looks like I made a tub full of passion fruit tea.
7000,7000,['cockatoo' 'mom' 'rain forest'],"What does your mom and a rain forest have in common? If you look deep enough in the bush, you might find a cockatoo."
7005,7005,['Beef Stroganoff' 'masturbating cow'],What do you call a masturbating cow? Beef Stroganoff.
7008,7008,['Nazi Germany' 'vaginas'],What do Nazi Germany and vaginas have in common? Their tendency to subjugate poles.
7018,7018,['donald' 'duck' 'elephant'],If a duck and a elephant were to vote They'd vote for donald trunk
7023,7023,['Breddit' 'neckbeard' 'scotch egg'],How does a neckbeard make a scotch egg? He has to Breddit
7037,7037,['Canadian bacon' 'Canadians' 'Italian sausage'],To understand the difference between Italians and Canadians all you need to know is two things. Italian sausage and Canadian bacon...
7038,7038,['Cakeday' 'Chinese gangster'],Cakeday special - what did the Chinese gangster do? Made him an offer he couldn't understand
7041,7041,['car stereo' 'ox input'],How do you plug a plow into a car stereo? Through the ox input.
7044,7044,['Hairless cats' 'Open relationships'],Two things I will never understand the appeal of: 1) Open relationships 2) Hairless cats
7045,7045,['census' 'gay'],"A local census says that on average, 1 in every 4 guys is gay I hope it's Dave- i think he's kinda cute"
7051,7051,['donkey' 'onion'],What do you call a cross between a donkey and an onion? A piece of ass that will bring a tear to your eye
7056,7056,['coffee' 'women'],I like my coffee like I like my women. Strong and Bitter
7063,7063,['TIFU' 'husband'],"TIFU by making my husband the wrong sandwich Oops, wrong sub!"
7067,7067,['lightbulb' 'mosquitoes'],How many mosquitoes does it take to screw in a lightbulb? Two. But I don't know how they got in there.
7088,7088,['Walmart' 'clearance bin'],"Fun Fact: If you lie down in an aisle at Walmart for a couple hours, they will tag you and put you in a clearance bin."
7090,7090,['Cinderella' 'Princess Diana'],What's the difference?? What's the difference between Cinderella and Princess Diana?  At midnight Cinderella's car didn't turn into a wall.
7092,7092,['popcorn kernel' 'waterboarding'],Forget waterboarding... I'm ready to tell this damn popcorn kernel stuck in my tooth everything it wants to know.
7095,7095,['diarrhea' 'genes'],Did you know that diarrhea is hereditary? It runs in your genes!
7103,7103,['Barbie doll' 'Disco Barbie' 'disco ball'],There is a new Barbie doll on the market - Disco Barbie ...dressed in chiffon; inclbiudes disco ball
7107,7107,['AIDS' 'Africa' 'mosquito nets' 'mosquitoes'],If only there were mosquito nets in Africa... We could save millions of mosquitoes from dying needlessly of AIDS.
7111,7111,['Genders' 'twin towers'],Genders are like the twin towers There used to be two of them and now it's a really touchy subject
7112,7112,['Egyptian airport security' 'LAX security' 'Los Angeles airport security'],What does Egyptian airport security have in common with Los Angeles airport security? Both have LAX security.
7116,7116,['GPS' 'refrigerator magnet'],Shutdown Apocalypse Update: GPS is down. Using a refrigerator magnet as a compass. I think it's just pointing to another refrigerator.
7119,7119,['lingerie models' 'self confidence' 'shopping cart'],"I got a shopping cart today with 4 working wheels, it was full of lingerie models and self confidence and I was dreaming"
7125,7125,['Bumble gum' 'bees'],What do bees chew? Bumble gum.
7134,7134,['Indian Flowers' 'Patels'],What do Indian Flowers grow? Patels.
7136,7136,['high sugar level' 'writing utensil'],Q: What did the writing utensil take for his high sugar level? A: Pencil-in.
7137,7137,['black Jew' 'gas chamber' 'white Jew'],What's the difference between a white Jew and a black Jew? The black Jew has to sit in the back of the gas chamber.
7147,7147,['Michael Phelps' 'adolf hitler'],whats the difference between Michael Phelps and adolf hitler Michael Phelps can finish a race
7148,7148,['chimps' 'monkeys'],"Told my grandma that some chimps and monkeys are learning to hunt with Spears. She responded with ""what? Are they gonna join isis too?"""
7149,7149,['Pottery Barn' 'goat'],"If the Pottery Barn didn't want me to bring my goat in the store, they shouldn't have called it a barn."
7153,7153,['George Zimmerman' 'Trayvon Martin'],What's the difference between George Zimmerman and Trayvon Martin? Zimmerman can dodge a bullet.
7155,7155,['Cheerios' 'donut seeds'],"What did the blonde say when she looked down at her bowl of Cheerios? Look, donut seeds!"
7160,7160,['all girls soccer team' 'pygmies'],What's the difference between an all girls soccer team and a tribe of pygmies? One is a bunch of cunning runts.
7170,7170,['biology teacher' 'eggs'],"My wife's a biology teacher... This morning she asked how I wanted my eggs. I told her, ""Ovariesy."""
7175,7175,['gas station attendant' 'porn star'],How do you tell if your gas station attendant is a former porn star? Right before he finishes pumping your gas he takes it out and sprays it all over your car
7176,7176,['Irene' 'Stanley Cup champions' 'coffee pot'],"What do a coffee pot, Irene, and the reigning Stanley Cup champions have in common? They're a-Brew'in!"
7179,7179,['Jews' 'Judaisms'],What do you call phrases that Jews often say? Judaisms.
7181,7181,['Woofleball' 'dogs'],What game do 18 dogs like to play during the summer? Woofleball
7182,7182,['jazz group' 'rock band'],The difference between a rock band and a jazz group The rock band will play 3 chords in front of 1000 people. The jazz group will play 1000 chords in front of 3 people.
7196,7196,['chef wife' 'cupcakes'],"I told my chef wife that if she were to leave me... please leave me one of your incredible cupcakes. She replied...""I won't dessert you."""
7197,7197,['porn' 'wedding rings'],You know you're in your 30's and single when you automatically look for wedding rings even while watching porn.
7198,7198,['9mm' 'indecent exposure' 'pulled over'],"The other day I got pulled over, and when the cop walked up I pulled out my 9mm Once he stopped laughing he wrote me up for indecent exposure"
7200,7200,['Priest' 'Rabbi'],"A Priest and a Rabbi were walking down the street. They spied a young boy playing up the street. The Priest said to the Rabbi, ""let's go up and fuck that boy"". The Rabbi said ""out of how much""."
7203,7203,['strip clubs' 'winter clothes'],I like to bring bags of winter clothes into strip clubs and tell them to cover up. Then yell how they're embarrassing the family.
7206,7206,['Russians' 'bears' 'gays'],What do Russians and gays have in common? They both like bears.
7216,7216,['Doctor' 'Priest' 'Rabbi'],"I'm going to hire a Priest, a Doctor and a Rabbi to walk into a bar together just to see WTF happens. Backup Plan: I'll also bring a horse."
7229,7229,['adult super vision' 'eye test'],I recently turned 18 and got an eye test Kind of bummed I didn't get adult super vision
7232,7232,['First world problems' 'humans'],"I can't wait until humans move to a new planet and someone says, 'Remember having 24-hour days?' and some jerk responds, 'First world problems.' -Geoffrey Asmus"
7240,7240,['Pillow fights' 'Stone Age'],Pillow fights didn't last as long in the Stone Age.
7250,7250,['booster seat' 'minivan'],I'm sitting in a booster seat in the back of a minivan because I want to teach my kids right and my 8yo called shotgun fair & square.
7251,7251,['gloves' 'sex toy'],I bought my wife some gloves and a sex toy for her birthday if she doesn't like the gloves she can go f*ck herself
7253,7253,['Gorilla' 'snowbank'],What's black brown and white black brown and white brown and white etc.? A Gorilla riding down a snowbank!
7262,7262,['podium salesman' 'wooden box'],"""Great speech! Have you thought about giving it from behind a wooden box for some reason?"" - podium salesman"
7266,7266,['kids' 'pathological lying'],"It's pretty amazing that I'm able to balance my two kids, my career as a doctor, and my pathological lying!!"
7269,7269,['bartender' 'jumper cables'],"Set of jumper cables walks into a bar... The bartender looks them up and down really slow and says, OK, I'll serve you, but don't be starting anything."
7272,7272,['Canadians' 'swimming'],"How do you get 50 Canadians out of the swimming pool? Say, "" Everyone out of the pool please."""
7283,7283,['Bob' 'dyslexic friend'],My dyslexic friend sobbed uncontrollably as he confessed that he kept spelling his own name backwards I really do feel for Bob.
7286,7286,['Barker Lounger' 'Price is Right'],What do you call a lazy fan of the old Price is Right? a Barker Lounger !
7290,7290,['Fatboy Slim joke' 'funk soul brother'],"When should I borrow the Fatboy Slim joke from the library? Right about now, funk soul brother. Check it out now, funk soul brother."
7292,7292,['Ouija boards' 'ghosts'],"I wonder if in 100 years, ghosts of today will spell out ""swag"" or ""bae"" on the Ouija boards"
7295,7295,['Alaska' 'Klondike bar' 'lesbians'],What do lesbians in Alaska sing? What would you do ew ew in a Klondike bar.
7305,7305,['Hummingbirds' 'birds'],Hummingbirds are just regular birds that can't remember the lyrics.
7306,7306,['BBQ' 'Canada'],How do you know when your BBQ is ready in Canada in April? The snow on top of it has melted.
7309,7309,['Truth' 'penis'],I named my penis Truth... Because bitches can't handle it!
7310,7310,['DNA' 'dental records' 'redneck murders'],Why are redneck murders hard to solve? No dental records and the DNA is all the same.
7315,7315,['Costco' 'gynecologist'],"Only my husband would walk up to my gynecologist in Costco, point at me, give him the two thumbs up while grinning and say, 'Nice one, huh?'"
7338,7338,['Pandapalegic' 'panda'],What do you call a panda who's legs don't work? Pandapalegic
7340,7340,['Cats' 'fuzzy houseplants'],Cats are just fuzzy houseplants that hate you.
7363,7363,['Malibu rum' 'sun tan lotion'],I can't figure out if I'm drinking Malibu rum or licking sun tan lotion off skin.
7368,7368,['Cal Tech' 'MIT'],"Why are Cal Tech and MIT constantly Fighting? Because MIT blames Cal Tech for stealing their Feynman, and there will never be another man as Fine."
7377,7377,['assassins' 'clowns'],Why do clowns hate assassins? Because they go for the juggler.
7389,7389,['hardware store' 'stud finders'],"I got banned from the hardware store Every time I walk in, all the stud finders start beeping."
7397,7397,['Frankish barbarians' 'Roman invasion'],"What did the old Frankish barbarians say to the Roman invasion? [](/dumbfabric)""You don't have the *Gaul* to do it!"""
7409,7409,['penis' 'phallusy'],What do you call a penis with bad logic? A phallusy.
7416,7416,['Dragon Ball Z' 'Gangnam Style' 'net neutrality'],Will net neutrality be defeated? Is the Gangnam Style finally over? Is Tupac really alive? Find out on the next episode of Dragon Ball Z
7426,7426,['atheist' 'bacon' 'religion'],I became an atheist when I found out there was a religion that prohibited bacon.
7427,7427,['Rec' 'cil' 'divorce'],"Judge: ""Reason for divorce?"" Me: ""Reconcilable differences."" Judge: ""Don't you mean irreconcilable?"" Me: ""Ugh. You sound just like her."""
7429,7429,['baseball cap' 'dog'],"cop: ""sir im afraid your dog is too cool for this neighbourhood"" me: [turns his little baseball cap round right way] cop: ""ok that's better"""
7431,7431,['Ethics Committee' 'FIFA' 'corruption scandal'],"Latest news from the FIFA corruption scandal: Shock announcement from FIFA's Ethics Committee: ""FIFA has an Ethics Committee"""
7432,7432,['HR' 'race card'],"According to HR, white people aren't issued a race card, and they'd appreciate if I went back to my desk. *shrugs*"
7441,7441,['Paris Hilton' 'hockey bag'],I walk around with a hockey bag filled with dildos & chihuahua's just in case Paris Hilton fires her assistant and is looking for a new one.
7443,7443,['AIDS' 'fungi'],Did you hear that AIDS isn't spread by a virus? Yeah! It's spread by a fungi!!
7449,7449,['adults' 'bouncy houses'],Why don't they make bouncy houses for adults? You'd spill your drink.
7450,7450,['dreadlocks' 'nfl players'],[pulls away from kissing] do you ever pretend nfl players with dreadlocks swinging around under their helmets are predators
7453,7453,['halal cucumber' 'halal lettuce'],What did the halal lettuce say to the halal cucumber ? Lets make salat
7463,7463,['Ellen Degeneres' 'Ricki Lake'],Did you hear that Ellen Degeneres just drowned? They found her face down in Ricki Lake
7469,7469,['internet' 'stag'],Why will you never see a stag on the internet? They like to stay anony-moose
7477,7477,['Brittany Spears' 'PEPSI'],THE TASTE OF A NEW GENERATION What do Brittany Spears and PEPSI have in common? They both have plastic juggs.
7479,7479,['Doss Family Mortuary' 'funeral home'],"My dad wants to open a funeral home.. Doss Family Mortuary : ""We'll take care of your stiffies for you"""
7480,7480,['Instagram' 'cocaine delivery service company'],You know what would be a good name for a cocaine delivery service company? Instagram
7482,7482,['bar tender' 'giraffe'],"A giraffe walks into a bar. He slides up to the bar tender and says ""High balls are on me""."
7484,7484,['Coffee line' 'backward sunglasses' 'ista' 'whipped cream'],[Coffee line] *Sees cute barista* *Twirls hair* No whipped cream please *Sees his backward sunglasses* *Drops hand* Never mind. Load it up.
7491,7491,['Creed' 'stapp infection'],Creed is Alter Bridge with a stapp infection.
7494,7494,['Frisbee' 'restraining order'],The restraining order doesn't mean we can't hang. It just says I can't get within 50ft of you. You wanna play catch or Frisbee or something?
7502,7502,['asymmetry' 'distorted mirrors'],The man who invented distorted mirrors has died. His funeral will be held in asymmetry.
